	Unnamed: 0	sentence	sentiment	translation
724	724	Mammokka Ennum oru lahariyaanu.Annum Ennum athbudappeduttiyittey ullu. Padam oru vambhan hittakum..minimum 250cr  kadakkum..lookam vaaythum mammotty enna	positive	Mammokka Ennum oru lahariyaanu.Annum Ennum athbudappeduttiyiittey ullu. Padam oru vambhan hittakum..minimum 250cr kadakkum..lookam vaaythum mammotty enna
725	725	Acting ഒരു രക്ഷയും illa.... baki illathoke pinne	positive	Acting no salvation illa.... baki illathoke pinne
726	726	Ivide Palakkad Jayettan Fans club nnu ashamsakal!!! Adichal romam ennikum athaanu Thrissur pooram	positive	Ivide Palakkad Jayettan Fans club nnu ashamsakal!!! Adichal romam ennikum athaanu Thrissur pooram
727	727	പടം പൊളിക്കും HBD mammokka       By Die hard ettan fan	positive	HBD mammokka By Die hard ettan fan
728	728	Mobile phonil kadapoolee ekkane ??appole theateril anakilo	neutral	Mobile phonil kadapoolee ekkane ??appole theateril anakilo
729	729	Onnum parayan illa laletta u trigger again ...	positive	Onnum parayan illa laletta u trigger again...
730	730	Dae Ajithaaa copy adikathada Mohan Lal	negative	Dae Ajithaaa copy adikathada Mohan Lal
731	731	Gilla plus loham plus ramaleelaa...naariya kopi adiii	negative	Gilla plus loham plus ramaleelaa...naariya kopi adiii
732	732	Dear Mammookka	positive	Dear Mammookka
733	733	Onnil kuduthal kanda trailer ambooo powli....	positive	Onnil kuduthal kanda trailer ambooo powli....
734	734	Ramesh pisharadi aanu director ennu kettapo valippu padam aakumennu karuthi..trailer kandapo mosamakilla ennoru prithisha vannu..	neutral	Ramesh pisharadi aanu director ennu kettapo valippu padam aakumennu karuthi..trailer kandapo mosamakilla ennoru prithisha vannu..
735	735	Official trailer release aakunnathinu mumbe dislike adikkan kure mammunni fans oolakal..	negative	Official trailer release aakunnathinu mumbe dislike adikkan kure mammunni fans oolakal..
736	736	As a mammokka fan trailer kidukki padam nalla oru vijayamayi theeratte	positive	As a mammokka fan trailer kidukki padam nalla oru vijayamayi theeratte
737	737	Youtube hang avan ready ayiko L	positive	Youtube hang avan ready ayiko L
738	738	ippo mansilai e padam 8 nilayil pottum	negative	ippo mansilai e padam 8 nilayil pottum
739	739	Onnu urappa full entertainment movie yaa.. Yente ponnu ikka fans onnu kaddak pidichaal oru blockbuster engu poorum ....	positive	Onnu urappa full entertainment movie yaa.. Yente ponnu ikka fans onnu kaddak pidichaal oru blockbuster engu poorum ....
740	740	Lalettan - Prithivi combo vera level...  Pwolichu Lalettan & Prithivi fans like adiku makkale	positive	Lalettan - Prithivi combo vera level... Pwolichu Lalettan & Prithivi fans like adiku makkale
741	741	Mammooka die Hard fans LIKE adichu polikk ith logam kaathu ninna RAJA yude varav ith polikkum	positive	Mammooka die hard fans LIKE adichu polikk ith logam kaathu ninna RAJA yude varav ith polikkum
742	742	29K Dislike adichavar Padam kandu kaanum lo... Oro Dhurendhangal...	negative	29K Dislike adichavar Padam kandu kaanum lo... Oro Dhurendhangal...
743	743	Alinje polinja trailer.. odiyan aakumo ?? 🤓🤓	negative	Alinje polinja trailer.. odiyan aakumo ?? 🤓🤓
744	744	Dialogue pora msmmookka paranjaal onnoode ushaaraayene	negative	Dialogue pora msmmookka paranjaal onnoode ushaaraayene
745	745	trailer kidukki look at the likes	positive	trailer kidukki look at the likes
746	746	38k views 20k like polichu	positive	38k views 20k likes polichu
747	747	Tovino.Namak uruttane... Ayyyo adipoki mass muvi ayrkum katta waiting	positive	Tovino.Namak uruttane... Ayyyo adipoki mass muvi ayrkum katta waiting
748	748	Direction maarakam prituiraaj nee tanne cheytathaano atho ariyunnavare kondu cheyyichathaano aaraayaalum massayittundu Well job man	positive	Direction maarakam prituiraaj nee tanne cheytathaano atho ariyunnavare kondu cheyyichathaano aaraayaalum massayittundu Well job man
749	749	Ichayan kasari. Kiduki. Porich. Njgal tcr karude swagraya ahagaram	positive	Ichayan kasari. Kiduki. Porich. Njgal tcr karude swagraya ahagaram
750	750	King is oll ways king 🤙  ഏട്ടൻ ഇഷ്ട്ടം	positive	King is always king 🤙 I love it
751	751	Amitha pratheesha vekunila anyway katta waiting #L	neutral	Amitha pratheesha vekunila anyway katta waiting #L
752	752	Nenjinakath Lalettan Nenjuvirich kond parayum numma oru lalettan fan anenn _______________katta waiting	positive	Nenjinakath Lalettan Nenjuvirich kond parayum numma oru lalettan fan anenn _______________katta waiting
753	753	sathyam paranjaal trailer oru maja illaa	neutral	sathyam paranja trailer oru maja illa
754	754	Padam average filim mathrameyullu fansukar pokkiparayunna rasamonnum padathinnillaa	neutral	Padam average filim mathrameyullu fansukar pokkiparayunna rasamonnum padathinnillaa
755	755	Vannu vannu avan vannuIkka love yuu	positive	Vannu vannu avan vannuIkka love yuu
756	756	Evdeyokkeyooo Oru pulimurugan...dadi Girija.. Fight.. Music...... Evdeyokkeyooo 🤔🤔🤔	neutral	Evdeyokkeyooo Oru pulimurugan...dadi Girija.. Fight.. Music...... Evdeyokkeyooo 🤔🤔🤔
757	757	Happy birthday mammukka  gana gandharvan polichadukkum next block bluster	positive	Happy birthday mammookka ganagandharvan polichadukkum next blockbuster
758	758	Nte ponnnoooo enthaaa makkkale immmale ikkkkade aaa oru idh🥰🥰🥰	positive	Nte ponnnoooo enthaaa makkkale immmale ikkkkade aaa oru idh 🥰🥰🥰
759	759	entry istam like for lusifer lalettan	positive	entry istam like for lucifer lalettan
760	760	Oru rakshayumilla.repeated mode on... Njan kandathil vech ettavum best trailer	positive	Oru rakshayum illa.repeated mode on... Njan kandathil vech ettavum best trailer
761	761	Katta pretheekshaaa....... Luv u alla ...	positive	Katta pretheekshaaa....... Luv u alla ...
762	762	Eeee cinema thanna venuchettan muthaaan muthumaniyaanu	positive	Eeee cinema thanna venuchettan muthaaan muthumaniyaanu
763	763	Ente ponno......maranamass item. Kidilan making. Fight apaaram. Sound modulation oru rakshayumilla. Oru adaru item thanne	positive	Ente ponno......maranamass item. Kidilan making. Fight apaaram. Sound modulation oru rakshayumilla. Oru adaru item thanne
764	764	Ini vendathu oru 100kodiyanu... athu ithiloode kittatte	positive	Ini vendathu oru 100kodiyanu... athu ithiloode kittatte
765	765	Padam vere level aaavum.... Mammulaaaal fanz	positive	Padam vere level aaavum.... Mammulaaaal fanz
766	766	Teaser pole oombiyilla.... Trailer kidukki....   Lalettan Fan	neutral	Teaser pole oombiyilla.... Trailer kidukki.... Lalettan Fan
767	767	Kozhopolla	neutral	Kozhopolla
768	768	6.3 dislike veru verupp athanne karanam	negative	6.3 dislike veru verupp athanne karanam
769	769	Mamangathine  Ajaygopal  fansinde vijayasamsakal.	positive	Mamangathine Ajaygopal fansinde vijayasamsakal.
770	770	Ende ponnoe ejathy trailer kandall ariyam ikka ethu rengill ulla allannennu	positive	Ende ponnoe ejathy trailer kandall ariyam ikka ethu rengill ulla allannenu
771	771	Orroo...framintayum quality     Rajuattan magic	positive	Orroo...framintayum quality Rajuattan magic
772	772	Mammootty pwolikkum	positive	Mammootty pwolikkum
773	773	Mammookka..... Uff ijjathi .. Ente ponnikkkaa polichuuu.... Katta waiting	positive	Mammookka..... Uff ijjathi .. Ente ponnikkkaa polichuuu.... Katta waiting
774	774	Haters pani thodangind makkale.....sahikunnilla avrkithe kanditte..	negative	Haters pani thodangind makkale.....sahikunnilla avrkithe kanditte..
775	775	Aettanta padathin ikka fansnte ashamsakal 🤗🤗🤗	positive	Aettanta padathin ikka fansnte ashamsakal 🤗🤗🤗
776	776	Yedaa Mamooty poora	negative	Yedaa Mamooty poora
777	777	avasanethe chadiyulla adi adh polich ikkaaaaaa	positive	avasanethe chadiyulla adi adh polich ikkaaaaaa
778	778	Madhuraraja teasor kandu nalla katta bore ayittu undu. Mammukka ethavana yum Vishnu Unnikrishnan tae boxoffice records vettikkum ennu thonunilla.	negative	Madhuraraja treasure kandu nalla katta bore ayittu undu. Mammukka ethavana yum Vishnu Unnikrishnan tae boxoffice records vettikkum ennu thonunilla.
779	779	Ente Ponno Goosebumps  ... kidu bgm	positive	Ente Ponno Goosebumps ... kidu bgm
780	780	Trending No . 1. Varanam jayettan daaaaaaaaaaa	positive	Trending No. 1. Varanam jayettan daaaaaaaaaaa
781	781	Pratheeksha nallonam und	neutral	Pratheeksha nallonam und
782	782	Unlike adicha mammunni fansinu irikkatte oru kuthirapavan	negative	Unlike adicha mammunni fansinu irikkatte oru kuthirapavan
783	783	Jeyetta padam full undo trailer il?? Sambavam colour aayittundalloo...	positive	Jeyetta padam full undo trailer il?? Sambavam color aayittundalloo...
784	784	Family entertainer? Family kk kanan pattatha movie full inner meaning	negative	Family entertainer? Family kk kanan pattatha movie full inner meaning
785	785	Vere Level One  Ikka - Rajuvettan	positive	Vere Level One Ikka - Rajuvettan
786	786	Entae jeevathil ithrayum pravishyam trailer kanda verae oru cinemayum illa	positive	Entae jeevathil ithrayum pravishyam trailer kanda verae oru cinemayum illa
787	787	Kidu frames kidu bgm ellarum kidu look kidu making pinne kidilolkidilan Lalettanum verentha vende heavy	positive	Kidu frames kidu bgm ellarum kidu look kidu making pinne kidilolkidilan Lalettanum verentha vende heavy
788	788	Njaanum our Tovino enna actora ishtapedunna alu thannaya trailer mass ayitundu but achaayanta soundinu mass effect kurachu kuravaanu	neutral	Njaanum our Tovino enna actora ishtapedunna alu thannaya trailer mass ayitundu but achaayanta soundinu mass effect kurachu kuravaanu
789	789	Madhurarajakku madhuram theereyundakilla bhayankara kaypayirikkum njan panthayam vekkam	negative	Madhurarajakku madhuram theereyundakilla bhayankara kaypayirikkum njan panthayam vekkam
790	790	Ikkaaaaa. Ingale ennaa level aah. Ee prayathilum body... Muthane	positive	Ikkaaaaa. Ingale ennaa level aah. Ee prayathilum body... Muthane
791	791	Raju ettan powli	positive	Raju ettan powli
792	792	Trailer cut ഒറ്റപേര് editor Donmax വേറെ ലെവൽ	positive	Trailer cut single name editor Donmax another level
793	793	Oh iyalude Ela padavum iyalu jailil kidana anubavavumayi copy Anu Nala pila anu enu kqnikan akum.	negative	Oh iyalude Ela padavum iyalu jailil kidana anubavavumayi copy Anu Nala pila anu enu kqnikan akum.
794	794	innanu movie kandathu.....kidu nnu paranjal pora......kidilokkidilam	positive	innanu movie kandathu.....kidu nnu paranja pora......kidilol kidilam
795	795	Trailer ethanennu mumbu thanne kore peru dislike adichatind Ivanmaaroke aanu e naadinu shapam champu naarikalu	negative	Trailer ethanennu mumbu thanne kore peru dislike adichatind Ivanmaaroke aanu e naadinu shapam champu naarikalu
796	796	Idvere vere chilar parannadaaannn muruga nee theernnada ennn ..ini nangal mammookka fans sherikkum parayunnnu .....MURUGAAA ....NEE THEERNNADA .IKKA LOVE	positive	Idvere vere chilar parannadaaannn muruga nee theernnada ennn ..ini nangal mammookka fans sherikum parayunnnu .....MURUGAAA ....NEE THEERNNADA .IKKA LOVE
797	797	sathyam parayalow kaNubol ente police traing kalam ormavarunu	positive	sathyam parayalow kaNubol ente police training kalam orma varunnu
798	798	Dislike adichavarod nammal lalettan fans n verum  pucham matrame ullu  Lalettan ishtam Lalettan uyir	positive	Dislike adichavarod nammal lalettan fans n verum pucham matrame ullu Lalettan ishtam Lalettan uyir
799	799	50.dhe pravshyem  kandu kolakkolli trailer	positive	50.dhe pravshyem kandu kolakkolli trailer
800	800	Iyaalkkokke cinema nirthi DQ nte makkale nokki veettil irunnoode..?	negative	Iyaalkkokke cinema nirthi DQ nte makkale nokki veettil irunnoode..?
801	801	Enta ponna oru rashayum ila kidu padam	positive	Enta ponna oru rashayum ila kidu padam
802	802	Suraj ettan powli..koode soubin ekka...pine paryano ....katta Waiting anee	positive	Suraj ettan powli..koode soubin ekka...pine paryano ....katta Waiting anee
803	803	Trailer kandappazhe urappichu padam mass vijayichu	positive	Trailer kandappazhe urappichu padam mass vijayichu
804	804	im from mars but i love laletan	positive	i'm from mars but i love lalettan
805	805	Ikkayude johny walker ormma varunnuu vere level	positive	Ikkayude johny walker ormma varunnuu vere level
806	806	Ithupole oru trailer iniyundakumennu thonunnilla. Superb	positive	Ithupole oru trailer iniyundakumennu thonunnilla. Superb
807	807	IKKA PWOLI BGM oru rakshayum illa	positive	IKKA PWOLI BGM oru rakshayum illa
808	808	Jayasurya chettan mass lookaaa pakka mass don	positive	Jayasurya chettan mass lookaaa pakka mass don
809	809	Mammookka de adutha 100 kodi padam aayirikkum #UNDA ennu urapp ullavar like adikkada pillere...	positive	Mammookka de adutha 100 kodi padam aayirikkum #UNDA ennu urapp ullavar like adikkada pillere...
810	810	6.1k mamunni fans ithe kandu ennu aa dislike button kandapol manasilayi	negative	6.1k mamunni fans in the kandu ennu a dislike button kandappol manasilayi
811	811	dayav cheyth pretham 3 irakkaruth plzzz athrank unda padamaayirnn pretham 2	negative	dayav cheyth pretham 3 irakkaruth plzzz athrank unda padamaayirnn pretham 2
812	812	Ikka fan aaya Nikku nalla urappundu	positive	Ikka fan aaya Nikku nalla urappundu
813	813	Ikka powlichu onnum parayanilla trailer ethanel padam enthakum	positive	Ikka powlichu onnum parayanilla trailer ethanel padam enthakum
814	814	To be very frank	negative	To be very frank
815	815	Tovino look. & BGM vere level	positive	Tovino look. & BGM vere level
816	816	bgm korachoode nannaakkayirunnu..fan made bgm poley.....	neutral	bgm korachoode nannaakkayirunnu..fan made bgm poley.....
817	817	Mass mass pakka masss	positive	Mass mass pakka mass
818	818	Mamangam...nte ammooo marana massss...trailer....   verum item allaaa.... ith oru onnonnara item anuu....ikkaaaaaaa	positive	Mamangam...nte ammooo marana massss...trailer.... verum item allaaa.... ith oru onnonnara item anuu....ikkaaaaaaa
819	819	Teaser ille kittiya mass triller ille kittilla	neutral	Teaser ille kittiya mass thriller ille kittilla
820	820	Dislike adikan mtram Kure per nokiyiriunna polund	negative	Dislike adikan mtram Kure per nokiyiriunna polund
821	821	Oru pandi padathinte trailer innu irangiyitundu...kandavar onnu parayane..avide ellaam thribilaa🤣🤣🤣	negative	Oru pandi padathinte trailer innu irangiyitundu...kandavar onnu parayane..avide ellaam thribilaa🤣🤣🤣
822	822	Njan oru ikka fan alla paksha as a malayali i am katta weiting for raja 2	positive	Njan oru ikka fan alla paksha as a malayali i am katta waiting for raja 2
823	823	Dislike adichavar ettavum valiya oolakal...... bldy idiots...	negative	Dislike adichavar ettavum valiya oolakal...... bldy idiots...
824	824	Karayippikuvo muthe... Happy bday ikka.... Waitg	positive	Karayip Pikuvo muthe... Happy birthday ikka.... Waiting
825	825	Eth vetavalliyanmara dislike adiche..	negative	Eth vetavalliyanmara dislike adiche..
826	826	Kanunnathinu munpe dislukke like adichaa ellaa malavangalkkum ente naduviral namaskaram	negative	Kanunnathinu munpe dislukke like adichaa ellaa malavangalkkum ente naduviral namaskaram
827	827	Ithu enthanu kilichundan mambazhamb 2 parto..hihi comedy padamanennu thonunnu	negative	Ithu enthanu kilichundan mambazhamb 2 parto..hihi comedy padamanennu thonunnu
828	828	Lalletan fansinte ella supportum und ikka.....  Ethu porikum.... Oru samsayavum venda...	positive	Lalletan fansinte ella supportum und ikka..... Ethu porikum.... Oru samsayavum venda...
829	829	ith oru oola padam aayirikum enn manass parayunu	negative	ith oru oola padam aayirikum enn manass parayunu
830	830	Ravanan aya avane nerkuner illaathakkan oru maha avatharam thanne vendi varum....poli	positive	Ravanan aya avane nerkuner illaathakkan oru maha avatharam thanne vendi varum....poli
831	831	Happy birthday Ikka love u  Pratheeshkal athiru kadanu Ganagandarvan keralakara keezhadakum	positive	Happy birthday Ikka love u Pratheeshkal athiru kadanu Ganagandarvan keralakara keezhadakum
832	832	Oru pooram Trilar Vijariichu Vannappooo oRu Mass Trilar aayiii thoonniyavarr Like Aahdii.....	positive	Oru pooram Trilar Vijariichu Vannappooo oRu Mass Trilar aayiii thoonniyavarr Like Aahdii.....
833	833	Trailer kollarkium nu oru pratheeksha ondarinnu...pakshe ithu athukkum mele	positive	Trailer kollarkium nu oru pratheeksha ondarinnu...pakshe ithu athukkum mele
834	834	Eathu nayinte makkal avao dislike adiche	negative	Ethu nayinte makkale davao dislike adichie
835	835	Polichu ikka suppar u r great	positive	Polichu ikka suppar u r great
836	836	Ith ini indian cinema yude mamangam	positive	Ith ini indian cinema yude mamangam
837	837	Dislike um kurayunnu..23k ninnu 13k aayi...appo ee chettatharam kanichathu aaru ennu parayendelloo	negative	Dislike um kurayunnu..23k ninnu 13k aayi...appo ee chettatharam kanikhathu aaru ennu parayendelloo
838	838	Ipo tanne 5 vattam kandu vallatoru trailer	positive	Ipo tanne 5 vattam kandu vallatoru trailer
839	839	Super  bb.  Lalettaaaa	positive	Super bb. Lalettaaaaa
840	840	Njanetha parayendath......... Onnum parayaanilaaaaaaa..... Laaaaalettttttttttaaaaaaaaaa.......ummmmmm aaaaaa	positive	Njanetha parayendath......... Onnum parayaanilaaaaaaa..... Laaaaaletttttttttaaaaaaaaa.......ummmmm aaaaaa
841	841	Pworich kurach kalangalaayi ijjathi padem Tamil mathram aannu kandirunnath .eni malayalathilum kannaan ulla bhagyem Ind .Poli Poli poli	positive	Pworich kurach kalangalaayi ijjathi padem Tamil mathram aannu kandirunnath .eni Malayalathilum kannaan ulla bhagyem Ind .Poli Poli poli
842	842	Next pullikaran stara or uncle loading 🤭	neutral	Next pullikaran stara or uncle loading 🤭
843	843	Trailer  kalaki Pwolichu  madhura raja cenimakku vendi katta waiting	positive	Trailer kalaki Pwolichu madhura raja cenimakku vendi katta waiting
844	844	Super trailer cinema kandale  bakkie parayan kaziykka llu	positive	Super trailer cinema kandale bakkie parayan kaziykka llu
845	845	Ithu pole bgm ulla mass trailer ithu vare iragiyittila .	positive	Ithu pole bgm ulla mass trailer ithu vare iragiyittila .
846	846	Music chila sthalangalil alambayi ....dialogue perfection kittunnilla	negative	Music chila sthalangalil alambayi ....dialogue perfection kittunnilla
847	847	Dislike full odiyan kanji fans	negative	Dislike full odiyan kanji fans
848	848	Odiyante sheenam njnga lalettante piller ee luciferil ang theerkum....	positive	Odiyante sheenam njnga lalettante piller ee luciferil ang theerkum….
849	849	Class trailer	negative	Class trailer
850	850	Lalettan illatha eanth sinima le makkale kodk like	positive	Lalettan illatha eanth sinima le makkale kodk like
851	851	Rajuvetta ningal maranmass love you oru great success avate....	positive	Rajuvetta ningal maranmass love you oru great success avate....
852	852	Lucifer movie kanditt  ethil comment edaan vannavar like adi.....  Mass lucifer lalettan mass	positive	Lucifer movie kandit ethil comment edaan vannavar like adi..... Mass lucifer lalettan mass
853	853	Kidukkachi  laletta ningal mass alla kolamassanu	positive	Kidukkachi laletta ningal mass alla kolamassanu
854	854	Ethu puthu charitharam.	positive	Ethu puthu charitharam.
855	855	Onnu vegam dec 14 ayya mathiyayirinnu	positive	Onnu vegam dec 14 ayya mathiyayirinnu
856	856	Kidukachi trailer... Bgm oru rekshayum ella.....	positive	Kidukachi trailer... Bgm oru rekshayum ella.....
857	857	Sathyam paranjaal trailer kandit vella majjeyonnullalla	positive	Sathyam paranjaal trailer kandit vella majjeyonnullalla
858	858	Hacking likes um Views um koottan nokiyitt moonjipoya mammootti fans evdede.. Oru Maryadhayoke Vendedey	negative	Hacking likes um Views um kootan nokiyitt moonjiya mammootty fans evdede.. Oru Maryadhayoke Vendedey
859	859	Ithu Kolakolli item Lalettan fans kathirunna padam Ith thakarkkum Lalettan fansnu aakosham mmakk pwopichadkkam	positive	Ithu Kolakolli item Lalettan fans kathirunna padam Ith thakarkkum Lalettan fansnu aakosham mmakk pwopichadkkam
860	860	Ithu Vera levelakum urappa..... Ela ikka fansinum all best....	positive	Ithu Vera levelakum urappa..... Ela ikka fansinum all best....
861	861	Ufffffff ichayaaa pwolich ur die hard fan 4 ever	positive	Uffffff ichayaaa pwolich ur die hard fan 4 ever
862	862	Adipoly🤩🤩lalettan fan thanne aaganamennilla sharaashari oru cinema premi aayaaal mathi ith kandit romaanjification undaagan🤩🤩🤩🤩🤩kidue !!!	positive	Adipoly🤩🤩lalettan fan thanne aaganamennilla sharaashari oru cinema premi aayaaal mathi ith kandit romaanjification undaagan🤩🤩🤩🤩🤩kidue !!!
863	863	Nalla padam ayirikatte odian pole akathirunnaal madi all the best	positive	Nalla padam ayirikatte odian pole akathirunnaal madi all the best
864	864	Kalam ethra poyallum charithra purushanmare prathinithikarikkan angh kazhiyunnundallo mammooka	positive	Kalam ethra poyallum charithra purushanmare prathinithikarikkan angh kazhiyunnundallo mammooka
865	865	Laalinu pakaram vere oru nadan akamayirunnu lal ithepole orupadu   cheyithittundu	negative	Laalinu pakaram vere oru nadan akamayirunnu lal ithepole orupadu cheyithittundu
866	866	Oooohhhh oru rakshayum illaaaa... Pwolii poppwoliiii  Ingalaan thaaram	positive	Oooohhhh oru rakshayum illaaaa... Pwolii poppwoliiii Ingalaan thaaram
867	867	Kilichundan maambazhathile slang . Oru matullalaa	neutral	Kilichundan maambazhathile slang. Oru matullalaa
868	868	Ende ponno 68 vayasaya oraluda body thanneyano ith.... 🤩.. NAMICHU PONNIKKAAAA	positive	Ende ponno 68 vayasaya oraluda body thanneyano ith.... 🤩.. NAMICHU PONNIKKAAAA
869	869	Immanuvel pokan pokunna item kikidu hbd mammokka	positive	Immanuvel pokan pokunna item kikidu hbd mammokka
870	870	Nanayitunduuu...... trailer kurachu koodi nanakam ayirunu	positive	Nanayitunduuu...... trailer kurachu koodi nanakam ayirunu
871	871	Surajettante voice oru podik koodi aged avannu	negative	Surajettante voice oru podik koodi aged avannu
872	872	Rashtriyam	negative	Rashtriyam
873	873	Minimum 3 Thavana kanathathayi arum kanilla....	positive	Minimum 3 Thavana kanathathayi arum kanilla....
874	874	Mass nnu paranjaa ikkayaanu.. MASTER of MASSES.. Adaar trailer.. Mammookkaaa	positive	Mass nnu paranjaa ikkayaanu.. MASTER OF MASSES.. Adaar trailer.. Mammookkaaa
875	875	njn kandathl Etavum mikacha trailer yennu thanne prym #ikka <3 .. #Ennum ikka	positive	njn kandathl Etavum mikacha trailer yennu thanne prym #ikka <3 .. #Ennum ikka
876	876	Kanji fans dis like adichu thakarkkunnudu	negative	Kanji fans dis like adichu thakarkkunnudu
877	877	Hpy bdya ma lovely ikka	positive	Happy birthday ma lovely ikka
878	878	Ikka fans kuthhy marinjalum luciferinete oru recordum thakarkilla	neutral	Ikka fans kuthhy marinjalum luciferinete oru recordum thakarkilla
879	879	Nte ponnikkaaa inghal enthinilla porappadilaaa nte ammooo poli	positive	Nte ponnikkaaa inghal enthinilla porappadilaaa nte ammooo poli
880	880	Ente ammo kidilam trailer  L___ && MR	positive	Ente ammo kidilam trailer ___ & MR
881	881	Katta waiting....  maranamass  trailer......	positive	Katta waiting....maranamass trailer......
882	882	All the best for movie mamankam...katta lalettan fan...	positive	All the best for movie mamankam...katta lalettan fan...
883	883	1:45 enta ponooo ..ota peru Mammootty...	positive	1:45 enta ponooo ..ota peru Mammootty...
884	884	Ejjath oru rakshayum llaaaa katta waiting	positive	Ejjath oru rakshayum llaaaa katta waiting
885	885	Ith verum mass alla marana mass	positive	Ith verum mass alla marana mass
886	886	Ente mone al powli ikka ishtam	positive	Ente mone al powli ikka ishtam
887	887	Appol  lalettante padathinte Record ellam  thakarthu  eriyan pokunnu alle ayikotte malayala  Cinema uratte	positive	Appol lalettante padathinte Record ellam thakarthu eriyan pokunnu alle ayikotte malayala Cinema uratte
888	888	Trailer kandathode padathinu oru theerumaanayi chali padam	negative	Trailer kandathode padathinu oru theerumaanayi chali padam
889	889	tamil-telungu-malayalam orrumichu  release  cheydhal  valiya orru  sambvam aggum	positive	tamil-telugu-malayalam orumichu release cheythal valiya oru sambvam aggum
890	890	Ente ponnnnoooooo.... Vere level	positive	Ente ponnnnoooooo.... Vere level
891	891	Njan laalettan fana pakshe i love this movie	positive	Njan laalettan fana pakshe i love this movie
892	892	Tovino machane fight scene poratto... eniyum valaraan undu	negative	Tovino machane fight scene poratto... eniyum valaraan undu
893	893	Oru prethikshayillarnu madhuraja but parayathirikan vayya visuals vere lvl	positive	Oru prethikshayillarnu madhuraja but parayathirikkanum vayya visuals vere level
894	894	Trailerin otta kurappama ullu njankluda ikkayuda face kandela	neutral	Trailerin otta kurappama ullu njankluda ikkayuda face kandela
895	895	Chechiuede mukham kandu like  cheythavar aroke ikka	positive	Chechiuede mukham kandu like cheythavar aroke ikka
896	896	Powli trailer  Ikka oru rakshayum illa kidu	positive	Powli trailer Ikka oru rakshayum illa kidu
897	897	Jo jeetha wohi sikhandar oke pole undu	neutral	Jo jeeta wohi sikandar ok pole und
898	898	Kidilan trailer .. ikka ushaarrr  ithu super hit aakumennu urappichavar ivide chumma likeetu pokko..	positive	Kidilan trailer .. ikka ushaarrr ithu super hit aakumennu urapichavar ivide chumma likeetu pokko..
899	899	Lalettan Masss Lalettan ki jaiii	positive	Lalettan Mass Lalettan ki jai
900	900	Lucifer ini kandam vayi odedi varum	negative	Lucifer ini kandam vazhi odedi varum
901	901	laletta polliku full support annu	positive	laletta polliku full support annu
902	902	.35 oru pulimurukan touch vannu .enthayaalum sambavam kidkeetund	positive	.35 oru pulimurukan touch vannu .enthayaalum sambavam kidkeetund
903	903	Mamooka we love u so much..	positive	Mammootty we love u so much..
904	904	Kalki super hit akum enn Bonny parayan paranju	positive	Kalki super hit akum enn Bonny parayan paranju
905	905	Oru kgf trailer polee.. Lalettan pakkaa massss	positive	Oru kgf trailer polee.. Lalettan pakka mass
