	Unnamed: 0	Unnamed: 0.1	sentence	sentiment	transliteration	translation
0	0	0	hoo mammokka police vesham aaha anthas	positive	ഹോ മമോക്കാ പോലീസ് വേഷമ ആഹാ അംതസ	Ho Mamoka Police costume Aha Amtasa
1	1	1	Oru rekshayum illa...kidilam kannu nananjupoyi	positive	ഓരു രേക്ഷയുംമ ഇല്ലാകിദിലമ കന്നും നാനംജുപോയി	one Reksha too Illakidilama The hill Nanamju went
2	2	2	Ikka     waiting.........	positive	ഇക്കാ     വൈറ്റിങ്	Ika Whiting
3	3	3	Raju Ettante Oro Shorttum Ijathi ppwli	positive	രാജു ഏട്ടാന്തേ ഓരോ ശോര്ത്തമ ഇജാഥീ പ്പ്വ്ലീ	Raju Eighteen each shortness of breath Ijathi Pvlee
4	4	4	Ettan fansil netti poya aarenkilum undo?    #maduraraja#waiting #	positive	ഏത്തന ഫംസില നേത്തി പോയാ ആരേന്കീലുമ ഉന്ഡോ    മദുരരജവൈറ്റിങ് 	What is it? Famsila Got it go away Who are you? undo Madurarajawaiting
5	5	5	Last aa chadi adi.... Uff.        Frm an ettan fan	positive	ലാസ്റ്റ് ആ ചാദീ ആദി ഉഫ്ഫ        ഫ്ര്മ ആന ഏത്തന ഫന	Last That Chadee Adi Phew Frm elephant What is it? Fana
6	6	6	heavy mass	positive	ഹേവ്യ മാസ	Hevya month
7	7	7	Pulimurgan 2 adyam oralde thallu. Pinne same kattil ottakkulla adi.	neutral	പുലിമുര്ഗന 2 ആദ്യമ ഓരാല്ഡ് തല്ലു പിന്നേ സമേ കത്തില ഒട്ടാക്കുല്ലാ ആദി	Pulimurgana 2 First daughter Orald hit Then same in the letter No camel Adi
8	8	8	Nte ponno oru raksha Illa Ennaaa Trailer	positive	നീം പോനനോ ഓരു രക്ഷാ ഇല്ലാ എന്നാ ട്രേല്ര്	Neem Don&#39;t go one Raksha no I mean The trailer
9	9	9	Mammookka fans like adi. Love u ikka	positive	മമൂക്കാ ഫംസ ലീകേ ആദി ലവ ഉ ഇക്കാ	Momoka Phamsa Leakey Adi Love U Ika
10	10	10	Oh mass o mass laletta katta waiting....Bgm	positive	ഓ മാസ ഒ മാസ ലാലെട്ടാ കട്ടാ വൈറ്റിങ്ബമ	oh month O month Laletta Kata Whitingbama
11	11	11	Ith powlichu vaariyitte pooku....	positive	ഇത പോവ്ലീചു വാരിയിറ്റ് പൂകു	This Povlich Variet the flower
12	12	12	7.3k dislike adichavanmaarod onne parayanollu......  OMKV	negative	73ക ഡിസ്ലീകേ ആദിചവന്മാരോദ ഓന്നേ പരായനോല്ലു  ഓമക്വ	73 k Dislike Adichavanoroda Onne Parayanollu Omakwa
13	13	13	June 16 Keralakara ilakki marikkum ikka	positive	ജൂണ് 16 കേരളകര ഈലാക്കീ മാരീക്കുംമ ഇക്കാ	June 16 Kerala Ealaki Marikumma Ika
14	14	14	Padam kandu kollaam pakshe chila idangalil lag und ennu eniku thoni	neutral	പദമ കാണ്ഡു കൊലാം പക്ഷേ ചിലാ ഇദാംഗലില ലഗ ഉണ്ട് എന്നു ഏനീകു ഥോനീ	Padma Kandu kill But some This is not the case Laga There is that Many Thoney
15	15	15	Ikka de carter hit aavm Maamankam ennathil oru samsyavum vndaaa	positive	ഇക്കാ ഡി കാര്റ്റര് ഹിത ആവമ മാമാംനകമ എന്നഥീല ഓരു സമ്സ്യാവുംമ വ്ന്ദാ	Ika D Carter Hita Awama Mamamnakama Therefore one Is it a problem? Wow
16	16	16	vaada a otta vili athu mathi .athu maathram mathi	positive	വാദാ ആ ഓട്ടാ വിലീ അതു മഥീ അതു മാഥ്രാമ മഥീ	argument That run Wiley that Matthew that Mathrama Matthew
17	17	17	#mamangam uff ijjathi trailer oru rakshem illa poli	positive	മമംഗമ ഉഫ്ഫ ഇജ്ജാഥീ ട്രേല്ര് ഓരു രക്ഷേമ ഇല്ലാ പോളി	Mamanga Phew Ijjathi The trailer one Welfare no Polly
18	18	18	Nalla polippan school life kanam katta waiting for you Mammukka	positive	നല്ലാ പോലിപ്പന സ്കൂല് ലീഫ് കനാമ കട്ടാ വൈറ്റിങ് ഫര യൂ മമ്മുക്കാ	good Polypana School Leaf Kanama Kata Whiting Fara Yu Momma
19	19	19	Feeling sad am studying in punjab ivde release aakuvo	negative	ഫിലിങ്ങ് സാദ ആമ സ്തുഡ്യിംഗ് ഇന് പഞ്ചാബ് ഇവ്ഡ് റേലീസ് ആകുവോ	The filling Plain tortoise Studying In Punjab Evd Raleigh&#39;s whether
20	20	20	Telugu padam pole aavaathirunnal mathiyaayirunnu.fight okke ethandu athupole thanne	neutral	ടെലുഗു പദമ പോല ആവാഥീരുന്നല മാംഥീയായീരുന്നുഫൈറ്റ് ഓക്കേ ഈതാണ്ഡു അഥുപോല ഠാന്നേ	Telugu Padma like Avathirunnala The fight becomes dizzying okay Etandu like that Thane
21	21	21	INI aarum UNDA enna peril kaliyaakkilla.oru adaar trailer	positive	ഇനീ ആരുമ ഉണ്ഡാ ഏനനാ പെരില കലീയാക്കീലോരു അദാര ട്രേല്ര്	You Someone Unda Enana Perilla Kaliyakiloru Adara The trailer
22	22	22	Eee eid ikka ang edutthu ennu paranjekk	positive	ഈം ഏഇഡ് ഇക്കാ അംഗ ഏദുത്തു എന്നു പരന്ജേക്ക	Ahem Aid Ika Member Eduthu that Paranjeka
23	23	23	Ahaa hahaha ha.... Nte ponnikkka mutheeee	positive	അഹാ ഹഹാഹാ ഹാ നീം പോന്നീക്കാ മുഥീ	Aha Hahaha Ha Neem Don&#39;t go Muthi
24	24	24	Pwoolich....adhya 3 manikkoor il...30k kku mukalil views....	positive	പ്വൂലീചാധ്യ 3 മനിക്കൂര ഇല30ക ക്കു മുക്ലീല വിഏവ്സ	Poolichadhya 3 Manicure Leaf 30 kg to Mukleela Vevsa
25	25	25	Ithin dislike addikunavar lokka tholvikallayirkkum	positive	ഈതീന ഡിസ്ലീകേ അദ്ദീകുനാവര ലോക്കാ ഥോലവികല്ലായിര്ക്കുംമ	Athena Dislike Adhikunavara Loca Tholavikallairkumma
26	26	26	FDFS LOCKED  LALETTAN  RAJUETTAN  uff ejathi	positive	ഫ്ദ്ഫ്സ ലോക്കെഡ്  ലാലെത്തന  രാജുത്തന  ഉഫ്ഫ ഏജാഥീ	Fdfsa Locked Lalethana Rajuthana Phew Ejathee
27	27	27	Feel good movie 2019 le best movie aavum ithu urappu	positive	ഫീല ഗുഡ് മോവീഏ 2019 ലേ ബെസ്റ്റ് മോവീഏ ആവഉംമ ഇതു ഉറാപ്പു	Phila Good The movie 2019 Lay Best The movie Ummmm This Urapu
28	28	28	1k dislikes Ella dislike pannikalkum endhe naduviral namskaram	negative	1ക ഡിസ്ലീക്സ് ഏല്ലാ ഡിസ്ലീകേ പന്നീകാല്കുമ ഇന്ധേ നാദുവീരസ് നമ്സ്കാരാമ	1 k Disleaks Ella Dislike Pannikalkuma Inde Naduvirus Hello
29	29	29	2million... One day poolumaayillaaaa. Iragittt.. Great lalettaa	positive	2മിലിഓന് ഒന്ന് ദയ പൂലുംമാഇല്ലാ ഇരാഗിത്ത ഗ്രേറ്റ് ലാലെട്ടാ	2 million One mercy There is no pool Iragita Great Laletta
30	30	30	Eante ponnooo romanjam vannu poeonnum parayanilla	positive	ഈന്ത പോന്നൂ റോമംജമ വനനു പോഇയോന്നമ പരായനിലആ	date go Romamjama to the forest gone Parayanila
31	31	31	Eth oru onnonnara padam aavum enn urappullavar like adi	positive	ഏത ഓരു ഓനനോന്നാരാ പദമ ആവഉംമ ഏന ഉറാപ്പുല്ലാവര ലീകേ ആദി	Which one Onanonnara Padma Ummmm Ena Urapullavara Leakey Adi
32	32	32	Surajettan kunjunni mash ayi abhinayichal powlikku.m	positive	സുരജേത്തന കുന്ജുന്നീ മാശ അയീ അഭിനഇചല പോവ്ലീക്കുംമ	Surajetna Kunjunni Masha Aye acting Povlikumma
33	33	33	Pakka trailer. Rajuvettan Brilliance. Lalettante all time best character aavum.. luv u laletta	positive	പക്കാ ട്രേല്ര് രാജുവേത്തന ബ്രില്ലിയാന്സ് ലാലെട്ടാന്തേ എല്ല തിമ ബെസ്റ്റ് ചരാക്ട്ര് ആവഉംമ ലവ ഉ ലാലെട്ടാ	Paka The trailer royalties Brilliants Laletante Ella Tima Best Character Ummmm Love U Laletta
34	34	34	Lucifer kandu. Eny Ethu. Kananam.. Ohhhh.	positive	ലുസീഫര കാണ്ഡു ഏനി ഏതു കനനമ ഓംഹ	Lucifera Kandu Anny Which Kananama Omha
35	35	35	Lalettan fans full support und makkaleee......	positive	ലാലെത്തന ഫംസ ഫുഅല സുപ്പോര്ട്ട് ഉണ്ട് മക്കാലീ	Lalethana Phamsa Fuala support There is Macaulay
36	36	36	Adhikam hype venda	negative	അധീകമ ഹൈപ്പ് വേന്ദ്	Adhikama The hype Wend
37	37	37	Ithu kidukkum	positive	ഇതു കിടുക്കുമ	This I will get it
38	38	38	Padam 1 st day kaanum athu urappu.	positive	പദമ 1 സ്റ്റ് ദയ കാനുംമ അതു ഉറാപ്പു	Padma 1 St mercy Kanuma that Urapu
39	39	39	masss effect	positive	മാസ ഇഫക്ട്	month effect
40	40	40	Arudeyum kaneer oppan vannadhalla njn... !! Pakshe karayikunnavarude thala njn adichu pwolikkum🤙 full on full power	positive	അരുദേയമ കനീര ഓപ്പന വന്നാധല്ലാ നജന  പക്ഷേ കാരയീകുന്നവരുദേ ഠാലാ നജന ആദിച്ചു പ്വോലീക്കുംമ ഫുഅല ഓം ഫുഅല പവര്	Arudayama Kanira the opening It didn&#39;t come Najana But Those who care Tala Najana Aadi Pvolikumma Fuala Omg Fuala Power
41	41	41	Again Again Rajuvettan Theertha Ee vismayam kanaan vanne nokkunavarundoo...	positive	അഗൈന അഗൈന രാജുവേത്തന ഥീര്ഥാ ഈം വിസ്മയമ കനാന വാനേ നോക്കുനാവരുന്ദു	Again Again royalties Theertha Ahem Amazing Canaan Vane Let&#39;s look
42	42	42	Costumes Irshad khan Cherukunnuijj Poli mutheeee	positive	കോസ്റ്റസ് ഈര്ഷദ ഖാന് ചേരുകുന്നുഇജ്ജ പോളി മുഥീ	Costus Jealousy Khan Joining Polly Muthi
43	43	43	Ithenkilum oru HIT enkilum aayaal mathi.padachone adutha PADAKKAM aavalle	neutral	ഇഥേന്കീലുമ ഓരു ഹിത എന്കീലുമ ആയാല മാംഥീപദ്ചോന് അദുഥാ പദക്കമ ആവാല	Ithenkiluma one Hita Enkieluma Ayala Manthipadhon Adutha Word Avala
44	44	44	aaa last bhakam marana mass #mammookka	positive	ആ ലാസ്റ്റ് ഭാകാമ മാരാനാ മാസ മമൂക്കാ	That Last Bhakama Marana month Momoka
45	45	45	Big B 2 pole und	neutral	ബിഗ ബ 2 പോല ഉണ്ട്	Biga b 2 like There is
46	46	46	LALETTAAA MUTHEE POLICHU	positive	ലാലെട്ടാ മുഥീ പോളിചു	Laletta Muthi Polichu
47	47	47	Edhu kondu prethiraj neruthiyal Kollam	positive	ഏധു കോണ്ടു പ്രേഥീരാജ നേരുഥീയല കൊല്ലം	how many Condo Prethiraja Nerutheela Kollam
48	48	48	Mammotiyude look divasam kudunthorum kodi varikayannallo	positive	മമ്മോതീയുദേ ലൂക ദിവാസമ കുദുന്തരുമ കോദി വാരികയാന്നാലോ	O Mammothy Luke Divasama Kuduntaruma Cody What about weekly?
49	49	49	Natural venam polum side lottu maarinikke anganullavar korach mass okke nallaatha	negative	നാച്ചുറല് വേണാമ പോലുംമ സൈഡ് ലോട്ടു മാരീനീക്കേ അംഗനുല്ലാവര കോരച മാസ ഓക്കേ നല്ലാതാ	Natural don&#39;t want Even Side The lot Marinette Non-members the bark month okay not good
50	50	50	malayala sinimakkoru puthiya charithram pirakkatte !	positive	മലയലാ സിനീമക്കോരു പുഥീയാ ചരീഥ്രാമ പീരക്കാട്ട 	Malayalam Movie lovers Puthiya Charitrama Peerakatta
51	51	51	Koora padam	negative	കൂരാ പദമ	No Padma
52	52	52	Ennalum ente Idivettu suguna ninne ithilu kandillalo	negative	എന്നലുംമ ആന്റ് ഇദിവേത്തു സുഗുനാ നീന്നേ ഇതീലു കണ്ഡില്ലാലോ	but also Ant Idivethu Suguna you This is it Can&#39;t see
53	53	53	Oru  mikacha thriling movie aavum	positive	ഓരു  മികാചാ ത്രിലിങ്ങ് മോവീഏ ആവഉംമ	one Mikacha Thrilling The movie Ummmm
54	54	54	Undakku shesham mammookayude adutha natural movie	positive	ഉന്ദക്കും ശേഷമ മമൂകായുഡേ അദുഥാ നാച്ചുറല് മോവീഏ	Will be happy After Mamukayuday Adutha Natural The movie
55	55	55	Jayasurya chyuna a ella characters um pwoliya... Shaji pappen	positive	ജയസുര്യ ച്യുനാ ആ ഏല്ലാ ചരാക്ട്ര് ഉമ പ്വോലിയാ ശാജീ പപ്പേന	Jayasurya Chuna That Ella Character Uma Poolia Shaji Papana
56	56	56	Mammukka ningal bharikkanam Malayalam Cinema iniyulla kalavum	positive	മമ്മുക്കാ നീന്ഗല ഭാരീക്കനാമ മലയാളം സിനേമാം ഇനീയുല്ലാ കലവമ	Momma Ningala Bharikanama Malayalam cinema not you anymore Kalavama
57	57	57	Ende ammo aa mundu madakki vechulla aa chavitt !!! . laletta.	positive	ഏംഡേ അമ്മോ ആ മുണ്ഡു മദക്കീ വേചുല്ലാ ആ ചാവിത്ത   ലാലെട്ടാ	Amday Ammo That Mundu Alcohol Vechulla That Chavitta Laletta
58	58	58	Trailer I'll tannaayy full story uondu	positive	ട്രേല്ര് ഇല്ല തന്നായയ ഫുഅല സ്റ്റോറി ഉഓംഡു	The trailer no The same Fuala Story Uomdu
59	59	59	Oru BIGB  feel....  ..aiivaaaaa.  Pwolichuu	positive	ഓരു ബിഗ്ബ  ഫീല  ഈവാ  പ്വോലീചൂ	one Bigba Phila Eva Please
60	60	60	Pinneyum pinneyum kaaaanunnavar like adi... Lalatten ishtam	positive	പിന്നേയുംമ പിന്നേയുംമ കാനുംന്നാവര ലീകേ ആദി ലാലത്തേന ഇശ്തമ	And again And again Kanunnavara Leakey Adi Lalatena Ishtama
61	61	61	Positive kittiyal pinne parayandallo.... Ettan fan aaya njan thanme kannu thalli poi bookings kandu	positive	പോസിറ്റീവ് കിത്തിയല് പിന്നേ പരായണന്കല്ലോ ഏത്തന ഫന ആയാ ന്ജന താന്മ കന്നും തല്ലീ പോയ് ബുക്കിങ്ങ്സ് കാണ്ഡു	Positive In Kithiel Then Read it What is it? Fana Aya Njana self The hill hit go Bookings Kandu
62	62	62	Annum ennum ennum ikka mass 🤩🥰	positive	അന്നമ എന്നമ എന്നമ ഇക്കാ മാസ 	Annama Name Name Ika month
63	63	63	vere level trailer and bgm gopi sunder musical	positive	വേരാ ലെവല് ട്രേല്ര് ആന്റ് ബ്ഗ്മ ഗോപീ സുന്ദര മ്യൂസിക്കല്	Vera level The trailer Ant Bgma Gopi beautiful the musical
64	64	64	Padam irangiyittu  parayam mass ano class ano ennu?. Odiyan anubhavam kondu paranjatha	neutral	പദമ ഇരംഗിയീത്തു  പരായമ മാസ അനോ ക്ലാസ്സ് അനോ എന്നു ഓദിയാന അനുഭവമ കോണ്ടു പരംജതാ	Padma Arrived in Iran parayama month Ano Class Ano that Odiana experience Condo Paramjata
65	65	65	E masathew 28 enna date  nalathekakan pattuvoooo ..... pattillah allew.....wait chaiyanmm  ..	positive	ഏ മാസതേ 28 ഏനനാ ദേതേ  നാലാതേകാകാന പത്തുവഊ  പത്തില്ലാ അല്വ്വൈറ്റ് ചൈയാന്മ്മ  	A The month itself 28 Enana Dete To become the fourth ten years Not ten Alvwhite Chaiyanma
66	66	66	Jelli kettinte trailer bgm pole ind	positive	ജെല്ലീ കെട്ടീന്റ ട്രേല്ര് ബ്ഗ്മ പോല ഇന്ഡ്	Jelly not built The trailer Bgma like Ind
67	67	67	E traileril ntha chekutan undo	positive	ഏ ട്രേല്രില ന്താ ചേകുതന ഉന്ഡോ	A No trail what Chekutana undo
68	68	68	kalakki Kalakki. Onnum parayan illa	positive	കലാക്കീ കലാക്കീ ഓനനുംമ പരായണ ഇല്ലാ	Kalakee Kalakee Onanumma Recitation no
69	69	69	Oru saada nalla naatin purathe kada..athre ullu...aenike ishtta pettu.	positive	ഓരു സാദാ നല്ലാ നാടിന പുരാഥ കദാത്രേ ഉല്ലുഏനീകേ ഇശ്ട്താ പെട്ടൂ	one Sada good nadina Puratha Kadatre Ullueneike Ishta hurry up
70	70	70	Vere level of making nd lalettan was awesome	positive	വേരാ ലെവല് ഓഫ് മകിംഗ് ന്ദ ലാലെത്തന വാസ അവെസോമ	Vera level Off Making Nda Lalethana Vasa Awesome
71	71	71	Next Week china povan irikkana njan ithu kandeche njan povathullu	positive	നെക്സ്ട് വിക ചീനാ പോവന ഇരീക്കാനാ ന്ജന ഇതു കണ്ഡേശ ന്ജന പോവാഥുല്ലൂ	Next Vika China Go away Irikana Njana This Kandesh Njana Let&#39;s go
72	72	72	peter hein nte stunt ella cinema il um ore pattern aanallo	neutral	പേറ്റര് ഹൈം നീം സ്തുംത ഏല്ലാ സിനേമാം ഇല ഉമ ഓരേ പട്ടണ് ആനാല്ലോ	Peter Haim Neem thank you Ella cinema leaf Uma Ore the town Because
73	73	73	Ohoo mamooka powlikum ee jati tralier making kiduwee	positive	ഓഹൂ മമൂകാ പോവ്ലികുമ ഈം ജാതി ട്രാലിയറ് മകിംഗ് കിദുവി	Oooh Momoka Povlikuma Ahem caste Tralier Making Kiduvi
74	74	74	Onnum parayanilla. Vere leval movie ayirikkum	positive	ഓനനുംമ പരായനിലആ വേരാ ലേവല മോവീഏ അയീരീക്കുംമ	Onanumma Parayanila Vera Levala The movie Ayeerikumma
75	75	75	Raju ettaaaa ningal Vera level	positive	രാജു ഏത്ടാ നീന്ഗല വേരാ ലെവല്	Raju what Ningala Vera level
76	76	76	Ithoru onnonnara ITEM avumenn urappullavar LIKE ADI ലാലേട്ടൻ	positive	ഇതോരു ഓനനോന്നാരാ ഇതേമ അവുമേന്ന ഉറാപ്പുല്ലാവര ലീകേ ആദി ലലടടൻ	This one Onanonnara The same Avumenna Urapullavara Leakey Adi Lalatadan
77	77	77	Late aayi vannalum latest aayi varuvenne	positive	ലേറ്റ് ആയീ വന്നാലുംമ ലാറ്റ്സ്റ്റ് ആയീ വരുവേന്നേ	Late Yes come Latst Yes Do you want to come?
78	78	78	Lokal poyi Madhura raja teaser kanada	negative	ലോകല് പോയി മധുരാ രാജാ ടീസര് കനാഡാ	in the world gone madura the king Teaser Canada
79	79	79	Oru marana mass chitramaavatte laleeta lucifer	positive	ഓരു മാരാനാ മാസ ചിത്രമാവത്ത് ലാലീതാ ലുസീഫര	one Marana month Chitramavat Lalitha Lucifera
80	80	80	Kuru potti olikknna 1k poojappura fans🤣🤣🤣	negative	കുരൂ പോത്തി ഓലീക്ക്ന്നാ 1ക പൂജപ്പൂരാ ഫംസ	Come on gone Ollie 1 k Poojapura Phamsa
81	81	81	adiyum bahalavumillathe swasthamayi kandirikkan pattunna oru nalla cinema	positive	ആദിയുംമ ബഹലവുംമീല്ലാത സ്വാസ്ഥമയീ കന്ദിരീക്കന പത്തുന്നാ ഓരു നല്ലാ സിനേമാം	Adiyumma No fuss Peace be upon you Looking forward It&#39;s ten one good cinema
82	82	82	Mohanlal prithvi fans like adik lucifer bamber hit akum	positive	മോഹനലാല പ്രീഥ്വീ ഫംസ ലീകേ ആദിക ലുസീഫര ബാംബേര ഹിത അകുമ	Mohanalala Prithvi Phamsa Leakey Adika Lucifera Bambera Hita Akuma
83	83	83	Jayasurya mass after long time.podi pooram	positive	ജയസുര്യ മാസ അഫ്റ്റര് ലോംഗ് തിമിപോടി പൂരമ	Jayasurya month after Long Timipodi Purama
84	84	84	Mammukka ningalau muthhaaa oru rakshayilaaa kikiduuu	positive	മമ്മുക്കാ നീന്ഗല്വ മുഥ്ഹാ ഓരു രക്ഷയീലാ കികീദൂ	Momma long leg Mutha one Salvation Kiki Doo
85	85	85	Kure per dislike adich kuru pottikkunnund	negative	കുരേ പര ഡിസ്ലീകേ ആദിച കുരൂ പോട്ടിക്കുംന്നുംദ	Kure Para Dislike Adicha Come on Potikumnunna
86	86	86	Dislike adechath alla punnara makkalum anta veral നമസ്കാരം	negative	ഡിസ്ലീകേ അദേചത അല്ലാ പൂന്നാരാ മക്കാലുംമ അംത വേറല് നമസകര	Dislike indecision no Poonnaara McCallum Amta different Namasakara
87	87	87	Fight dialoge bgm oru rakshayum illa	positive	ഫൈറ്റ് ദീഅലോജ ബ്ഗ്മ ഓരു രക്ഷയുംമ ഇല്ലാ	Fight The Aloja Bgma one Salvation no
88	88	88	Ithu rajayude 3 strong Alla ettande Lucifer	neutral	ഇതു രാജയുദേ 3 സ്ട്രോംഗ് അല്ലാ ഏത്തംഡേ ലുസീഫര	This King 3 Strong no Anytime Lucifera
89	89	89	E padathinte making ushar aanenu thonunu..  Trailer kanditt padam kandathokem thallipoli aayirnu.  But trailer pwolichu	positive	ഏ പദതീന്റ മകിംഗ് ഉഷാര ആനേനും തോനുനു  ട്രേല്ര് കന്ദിത്ത പദമ കംദതോകേമ തല്ലിപോലി ആയീരനു  ബുത ട്രേല്ര് പ്വോലിചു	A Word of mouth Making pronunciation Anen too It seems The trailer Kandita Padma Kamdatokema Beaten up Ayeran Wednesday The trailer Polichu
90	90	90	Samyuktha vendayirunnu. :(  Aishu pwoli ann	negative	സമ്യുംക്ഥാ വേന്ദയീരുനനു   ഐശും പ്വോലി അന്ന	Samyumktha Vendairunan Aish too Powley Anna
91	91	91	Trailer erangiyilla adhinu munpe pedich thoori dislike adikunna mammunnyolikal	negative	ട്രേല്ര് ഇരാംഗീഇല്ലാ അധീനും മുന്പേ പേദീച ഥഊരീ ഡിസ്ലീകേ ആദികുന്നാ മമ്മുനിയഓലികല്	The trailer No Irangi and under before Peedecha Thaooree Dislike Adi Kunna Mammuniaolikal
92	92	92	Dislike adikunna mandanmar ariyunnilla ithu open akkiyal views nte ennam koodum ennu	negative	ഡിസ്ലീകേ ആദികുന്നാ മംദനമാര അരീയുന്നീല്ലാ ഇതു ഓപേന അക്കീയല വിഏവ്സ നീം എന്നമ കൂഡുംമ എന്നു	Dislike Adi Kunna Madanamara No need This open Akeela Vevsa Neem Name Kudumma that
93	93	93	JAI LUCIFER JAI LALETTAN JAI PRITHWI	positive	ജയ ലുസീഫര ജയ ലാലെത്തന ജയ പ്രീഥ്വീ	Jaya Lucifera Jaya Lalethana Jaya Prithvi
94	94	94	Nalla punch ulla trailer mamooka Jai anusree shamna ellarkum bst of luck	positive	നല്ലാ പഞ്ച് ഉല്ലാ ട്രേല്ര് മമൂകാ ജയ അനുസ്രീ ശാമ്നാ എല്ലാര്കുമ ബ്സ്റ്റ് ഓഫ് ലുക്	good Punch Ullah The trailer Momoka Jaya Anusri Shamna Everyone Bst Off Look
95	95	95	Bro support koduthilenkilum dislike adikkathirunoode .	negative	ബ്രോ സുപ്പോര്ട്ട് കോദുതീലേന്കീലുമ ഡിസ്ലീകേ ആദിക്കതീരുനൂഡേ 	Bro support Kodutheelenkiluma Dislike From the beginning
96	96	96	Suraj ettan fans fans like ivide	positive	സൂരജ് ഏത്തന ഫംസ ഫംസ ലീകേ ഇവിഡ്	Suraj What is it? Phamsa Phamsa Leakey Evid
97	97	97	Eid usharakkanam ..Ithiri late ayalum nammal polikkum. Mammukka sa	positive	ഏഇഡ് ഉഷാരക്ബനാമ ഇഥീരീ ലേറ്റ് അയാലുമ നമ്മല പോലിക്കുംമ മമ്മുക്കാ സാ	Aid Usharakbanama ethereal Late Ayaluma We are Pollykumma Momma Sa
98	98	98	E padam hit akum enn urapullavar like adikan ulla sthalam🥰🥰🥰	positive	ഏ പദമ ഹിത അകുമ ഏന ഉരാപുല്ലാവര ലീകേ ആദികന ഉല്ലാ സ്ഥാലമ	A Padma Hita Akuma Ena Urapullavara Leakey Adikana Ullah Stalama
