	Unnamed: 0	Unnamed: 0.1	sentence	sentiment	transliteration	translation
2148	2148	2148	laletta na pole orale ullu malayalikalude ahagaramaya mohnlal	positive	ലാലെട്ടാ നാ പോല ഓരേല് ഉല്ലു മലയാലികാലുഡേ അഹഗരാമയാ മോഹനലാല	Laletta Na like Orel Chili Malayali Kaluday Ahagaramaya Mohanalala
2149	2149	2149	Ithu pradheekshikuna ....pole avilla ...padam avarage ...	neutral	ഇതു പ്രധിക്ശീകുനാ പോല അവില്ലാ പദമ അവരാഗ 	This Pradhiksikuna like There is no Padma Avaraga
2150	2150	2150	Youtube enagne  hang akathirikkum .korach koodiya item alle vannikkn	positive	യൌതുബേ ഏനാഗ്നേ  ഹംഗ അകാഥീരീക്കുംമ കോരച കുഡിയാ ഇതേമ അല് വന്നീക്ക്ന	YouTube Enagne Hanga Akathirikumma the bark Kudia The same Al Don&#39;t come
2151	2151	2151	Pulimurugan copy adi pole ind stund seen ellam	neutral	പുലിമുരുഗന കോപി ആദി പോല ഇന്ഡ് സ്തുംഡ് സീന ഏല്ലമ	Pulimurugana Angry Adi like Ind Stumped Seena Ellama
2152	2152	2152	Ee vishuvinu Madhura Rajayude oru Madhura കണി....  By a Lalettan Fan	positive	ഈം വിശുവീനും മധുരാ രാജയുദേ ഓരു മധുരാ കണ  ബി ആ ലാലെത്തന ഫന	Ahem Vishuveen too madura King one madura Kan B That Lalethana Fana
2153	2153	2153	38000000 viewrs oh my goddddddddddddddddd  megastar the gr8	positive	38000000 വിയര്സ ഓ മീ ഗോഡ്ഡ്  മേഗാസ്തര് ദ ഗ്ര8	38000000 Vierza oh m Godd Megastar The Gr8
2154	2154	2154	Trailer pora..Oru pathu kollam mumbulla tamil cinemade trailer polund	negative	ട്രേല്ര് പോരാഓരു പതു കൊല്ലം മുംബുല്ലാ തമിഴ് സിനിമദേ ട്രേല്ര് പോലുംണ്ട്	The trailer not enough Ten Kollam Mumbulla Tamil Movie The trailer There is even
2155	2155	2155	Oru 10 thavana kandu	positive	ഓരു 10 താവാനാ കാണ്ഡു	one 10 Tawana Kandu
2156	2156	2156	Mammukka oru rakshayumilla. Mammukka mass ....	positive	മമ്മുക്കാ ഓരു രക്ഷയുംമില്ലാ മമ്മുക്കാ മാസ 	Momma one There is no escape Momma month
2157	2157	2157	trailet ingana.appo cinema enganayundanne parayano... katta waiting..KL 40 fans	positive	ട്രേല്റ്റ് ഇന്ഗനാപ്പോ സിനേമാം ഇംഗനായുംദന്നേ പരായണനോ കട്ടാ വൈറ്റിങ്ക്ല 40 ഫംസ	Trail Inganapo cinema Inganaiumdanne Reciting Kata Whitingla 40 Phamsa
2158	2158	2158	Orumathiri tamil mass padam pole thonnunu...daivam noke parangu politiciansne oke ingane thalapathuvekkunne aavishamillatha hype alle ???.	neutral	ഓരുമാംഥീരീ തമിഴ് മാസ പദമ പോല തോന്നുംനുദൈവമ നോക പരംഗു പോളിറ്റീസ്യംസ്നേ ഓകേ ഇന്ഗണേ തലാപതുവേക്കുന്ന ആവീശമില്ലതാ ഹൈപ്പ് അല് 	You remember Tamil month Padma like It seems like God look Parangu Politicians okay so Head-scratching No enthusiasm The hype Al
2159	2159	2159	Entee ponn ettaaa..... 1:50 ullayaa ah dialogue oru rekshayum illaaa.....  VAAA DA.....	positive	എന്റീ പോനന ഏത്ടാ 150 ഉല്ല്യാ അഹ ദീഅലോഗു ഓരു രേക്ഷയുംമ ഇല്ലാ  വാ ദ	My Ponana what 150 Ullya Ah The dialogue one Reksha too no Come The
2160	2160	2160	Ipo allarkkum manasilayille lalunni charitra padam cheytal ingane undakum enn this is odiyan 2	negative	ഇപോ അല്ലാര്ക്കുംമ മാനസീലാഇല് ലാലുന്നീ ചാരിത്ര പദമ ചേയതല് ഇന്ഗണേ ഉന്ദകുമ ഏന തീസ ഇസ ഓദിയാന 2	now No one In Manasila Lalunni Charitra Padma Cheetah so Undakuma Ena Thesa Isa Odiana 2
2161	2161	2161	Padam kandu .....sidheeq ikka ....karayipikum alle ..ithoru sheelavakanda	positive	പദമ കാണ്ഡു സീധിക ഇക്കാ കാരാപികുമ അല് ഇതോരു ശീലാവാകംദാ	Padma Kandu straight Ika Carapikuma Al This one Silavakamda
2162	2162	2162	Ikkaaaaa masss enn vechaal ithaam masss	positive	ഇക്കാ മാസ ഏന വേചാല ഇഥാമ മാസ	Ika month Ena Vechala Ithama month
2163	2163	2163	mohanlal anna ningal veru mass alla kola massaa	positive	മോഹനലാല അന്നാ നീന്ഗല വേരു മാസ അല്ലാ കോലാ മസാ	Mohanalala Anna Ningala the root month no Koala Masa
2164	2164	2164	Mohanlal. THE GREATEST OF ALL GREATES.	positive	മോഹനലാല ദ ഗ്രേറ്റ്സ്റ്റ് ഓഫ് എല്ല ഗ്രേറ്റ്സ്	Mohanalala The The greatest Off Ella Greats
2165	2165	2165	Pooran mamooty	negative	പൂരണ മമൂടി	complete Mammootty
2166	2166	2166	entho missing aanu	neutral	എന്ഠോ മീസ്സിംഗ് ആനു	what Missing Anu
2167	2167	2167	Ellarum ikka ikkaa...Njan mathram anooo unni chettane mention cheyunnadh...Unni chettante pwoli	positive	എല്ലാര്മ ഇക്കാ ഇക്കാംജന മാതരാമ അനൂ ഉന്നീ ചേട്ടാനേ മെന്റേഷന് ചേയുംന്നാധുന്നീ ചേട്ടാന്തേ പ്വോലി	Ellarma Ika Ikamjana Matarama Anoo You are dude for mentation Do it Chetante Powley
2168	2168	2168	Lucifernne EzHuayallathu varakilla nnu urapaa pakshe padam pulimuragan level hittaa athu suraa	neutral	ലുസികറ്ന്നേ ഈഝ്ഹുആയല്ലാതും വരകില്ലാ നനു ഉരാപാ പക്ഷേ പദമ പുലിമുരഗന ലെവല് ഹിത്താ അതു സുരാ	Dear Lucy It is not Ejhhua Can&#39;t draw Nanu Urapa But Padma Pulimuragana level Hita that Sura
2169	2169	2169	Raju etta ningal Malayala cinema ye Vere Level Aaakum Alle	positive	രാജു എട്ടാ നീന്ഗല മലയലാ സിനേമാം യേ വേരാ ലെവല് ആകുമ അല്	Raju eight Ningala Malayalam cinema Yeh Vera level will be Al
2170	2170	2170	Variety cinemayude rajav  mammooseeee ikkaaaaaaa	positive	വരീഏറ്റി സിനേമയുദേ രാജാവ  മമ്മൂസീ ഇക്കാ	Lined up Cinema the king Mammouse Ika
2171	2171	2171	Eee vishu ettan aganu konduvaa ennu parayan paranju!!!!!!	positive	ഈം വിശു ഏത്തന അഗനു കോന്ദുവാ എന്നു പരായണ പരംജു	Ahem Vishu What is it? Aganu Kondua that Recitation Paramju
2172	2172	2172	Entta ponnu laletta.... Parayan vakkukal illa  Mass ka bapp	positive	എന്ട്ടാ പോനനും ലാലെട്ടാ പരായണ വക്കുകല ഇല്ലാ  മാസ കാ ബാപ്പ	what Ponan too Laletta Recitation Art no month Ka Dad
2173	2173	2173	Ithippo enthinulla purappadanavo randalum koodi Suraj  Soubi	positive	ഇഥീപ്പോ എന്ഥീനുല്ലാ പുരാപ്പദനാവോ രന്ദലുംമ കൂഡി സൂരജ്  സൌബീ	This is Why not? Ancient Randallumma too Suraj Saubee
2174	2174	2174	Waiting from Qatar LalettaI'd tagarkum katta support heavy 48pravasyam trailer kandu wow	positive	വൈറ്റിങ് കരോമ കാതാര ലാലെട്ടീഡ് ടാഗര്കുമ കട്ടാ സുപ്പോര്ട്ട് ഹേവ്യ 48പ്രവാശ്യമ ട്രേല്ര് കാണ്ഡു വാ	Whiting Caroma Katara Laletide Tagarkuma Kata support Hevya 48 Exile The trailer Kandu Come
2175	2175	2175	Ee item vech nammal nammade pracharanam thakarkkum..	positive	ഈം ഇതേമ വേച നമ്മല നമ്മദ് പ്രചരനാമ ഠാകരക്കമ	Ahem The same vecha We are Nammad campaign name Thakarakama
2176	2176	2176	enthe ponno enna lookkada mmmde eattan	positive	ഇന്ന പോനനോ ഏനനാ ലൂക്കാദാ മൈഡേ ഈത്തന	today Don&#39;t go Enana Lucada Mayday Ethana
2177	2177	2177	Ithu kidukkum Vere Levelu Aannu Makkaleee	positive	ഇതു കിടുക്കുമ വേരാ ലെവേലും ആന്നു മക്കാലീ	This I will get it Vera and level that&#39;s Macaulay
2178	2178	2178	Heavy mass        പൊളി	positive	ഹേവ്യ മാസ        പള	Hevya month the fruit
2179	2179	2179	Adutha flop	negative	അദുഥാ ഫ്ലോപ	Adutha Flopa
2180	2180	2180	Vere level ... Onnum parayan ella....	positive	വേരാ ലെവല്  ഓനനുംമ പരായണ ഏല്ലാ	Vera level Onanumma Recitation Ella
2181	2181	2181	Mamooka ishtam. Ennitum Njan Lucifer kandu laletante acting Kidu anennu mammokka fan aya enik parayAthirikan pattilla..	positive	മമൂകാ ഇശ്തമ എന്നീതുമ ന്ജന ലുസീഫര കാണ്ഡു ലാലേതന്തേ ആക്ടിംഗ് കിഡു അനേന്നു മമോക്കാ ഫന ആയാ ഏനിക പരായതീരീകന പത്തില്ലാ	Momoka Ishtama and the Njana Lucifera Kandu Lalethante Acting Kidu That&#39;s it Mamoka Fana Aya Enika Parayatheerikana Not ten
2182	2182	2182	Oru nalla cinema kkaayi kathirikkkunnu.    Dhayavayi ithine 100 cr pattikayil kettaruth	neutral	ഓരു നല്ലാ സിനേമാം ക്കായീ കഥീരീക്കുംന്നു    ധായാവായീ ഇതീന 100 ക്ര് പ്പാത്തികഇല കേത്തരുത	one good cinema Kayee Storytelling Good luck This is it 100 Kr Leaf untouchable
2183	2183	2183	Mass and class . Mammookka #faceofindiancinema . Nalla cinema aavatte	positive	മാസ ആന്റ് ക്ലാസ്സ്  മമൂക്കാ ഫൈസെഓഇന്ദ്യാന്സിനേമാം  നല്ലാ സിനേമാം ആവത്ത്	month Ant Class Momoka PhysioIndianemam good cinema Awath
2184	2184	2184	Rajuettan director ayath kond ith jaikkuvairikkum	positive	രാജുത്തന ദിരേക്ടര് അയാത കോണ്ട് ഇത ജൈക്കുംവൈരിക്കുംമ	Rajuthana Director Aayata Cont This Jaikumvairikumma
2185	2185	2185	Njan oru mohanlal fan aanu ennalum trailer istapettu pwoli	positive	ന്ജന ഓരു മോഹനലാല ഫന ആനു എന്നലുംമ ട്രേല്ര് ഇസ്ടാപെട്ടൂ പ്വോലി	Njana one Mohanalala Fana Anu but also The trailer Get ready Powley
2186	2186	2186	Ikka scene vere level	positive	ഇക്കാ സീന വേരാ ലെവല്	Ika Seena Vera level
2187	2187	2187	Ithupole mooonchiya Oru padam jeevithathil kanditillaaa.....	negative	ഇതുപോല മൂംചിയാ ഓരു പദമ ജീവീഥാതീല കംദിതീല്ലാ	Like this Moomchia one Padma For life Can&#39;t move
2188	2188	2188	Trailer kannunathinu munne dislike adicha mahanmark adaranjalikal....ivrk matram engana pattunoo ijathi kuru pottikal....kashtam...	negative	ട്രേല്ര് കന്നുനാതീനും മുന്നേ ഡിസ്ലീകേ ആദിചാ മഹാന്മാര്ക് ആദരാംജലികാലിവര്ക മാത്രമ ഇംഗാനാ പട്ടുനൂ ഇജാഥീ കുരൂ പോത്തികല്കശ്തമ	The trailer Kannadaen too before Dislike Adicha For the great ones Adaramjalikalivarka only Ingana Patunoo Ijathi Come on Pothikalkastama
2189	2189	2189	Uff kidilam oru ethum pediyum kittanilla story nthayirikkumenn 5vare Kath irikkanamallo katta waiting	positive	ഉഫ്ഫ കിദിലമ ഓരു ഏതുമ പേദീയുംമ കിത്താനിലആ സ്റ്റോറി ന്ഥായീരീക്കുംമേന 5വരേ കഥ ഇരീക്കനാമല്ലോ കട്ടാ വൈറ്റിങ്	Phew Kidilama one Any Pediyaumma Where is it? Story Nthayirikummena Until 5 story I&#39;m sorry Kata Whiting
2190	2190	2190	Etinum valiya surprise enni njngallu kittan ella	positive	ഏതിനം വാലീയാ സുരപ്രീസ എന്നീ ന്ജ്ന്ഗാല്ലൂ കിത്തന ഏല്ലാ	how much Wallia Surapreesa and Njngalloo kithana Ella
2191	2191	2191	LUCIFER KI JAY  LALLETTAN POLICHU MASS  VERUM  MASSALA  MARANA MASS LOVE  YOU LALLETTAAAAA	positive	ലുസീഫര കി ജയ  ലാലെട്തന പോളിചു മാസ  വേരുമ  മസ്സാലാ  മാരാനാ മാസ ലവ  യൂ ലാലെട്ടാ	Lucifera K Jaya Lalethana Polichu month Varuma Masala Marana month Love Yu Laletta
2192	2192	2192	Joy thakkolkaaranil ninnum oru massZz change	positive	ജോയ ഠാക്ക്ല്കാരനീല നീന്നമ ഓരു മാസ്സീജ് ചംഗേ	Joya Thakkalkara Neela the length one Massage Change
2193	2193	2193	Njangada nattila shooting cheythe Prithviraj vere level	positive	ന്ജംഗാദാ നാത്തിലാ ശൂട്ടിങ്ങ് ചേയ്ദ പ്രീഥ്വീരാജ വേരാ ലെവല്	Njangada in the country Shooting Cheida Prithviraj Vera level
2194	2194	2194	Padam 100 cr kayariyathinu shesham kanunnavarundo	positive	പദമ 100 ക്ര് കയരീയാഥീനും ശേഷമ കനുംന്നാവരുണ്ടോ	Padma 100 Kr and Kayariathin After Do you have any friends?
2195	2195	2195	Myru Padam. Kaanendaayirunnu. Ookkaanam vannittu vayya.	negative	മ്യ്രു പദമ കാനേന്ദ്യഈരുനനു ഊക്കാനമ വന്നീത്തു വയ്യാ	Myru Padma To Kanendyairuna Ukanama came can&#39;t
2196	2196	2196	Ikka kku nalla age feel cheyuunuu	neutral	ഇക്കാ ക്കു നല്ലാ അജ് ഫീല ചേയുംഉനൂ	Ika to good Aj Phila Yes and no
2197	2197	2197	anusithaaraye kaanan veendi trailer kandavar ivide like cheythooli	positive	അനുസീഥാരാഏ കാനന വിംദീ ട്രേല്ര് കാന്ദാവര ഇവിഡ് ലീകേ ചേയ്ഥഊലീ	Anuseetha Canon Vimdee The trailer Kandavara Evid Leakey Cheithoolee
2198	2198	2198	Kiduuu Trailer   Lalettan polichuu Apol ee onavum ettan kondupoi	positive	കിദൂ ട്രേല്ര്   ലാലെത്തന പോളിചൂ അപോല ഈം ഓനവമ ഏത്തന കോന്ദുപോയ്	Kidoo The trailer Lalethana Polychoo apola Ahem Onavama What is it? Kondupoi
2199	2199	2199	Njan A10 Fan ann but ikka pwolikkum katta waiting	positive	ന്ജന ആ10 ഫന അന്ന ബുത ഇക്കാ പ്വോലീക്കുംമ കട്ടാ വൈറ്റിങ്	Njana That 10 Fana Anna Wednesday Ika Pvolikumma Kata Whiting
2200	2200	2200	Mammookkaaaa love uuuuu ingal poliyanuuuuuu 68 alla ingakk  34 aanuuuuuu	positive	മമൂക്കാ ലവ ഊ ഇന്ഗല പോലിയാനൂ 68 അല്ലാ ഇന്ഗാക്ക  34 ആനൂ	Momoka Love Oh Engala Polianu 68 no Ingaka 34 Anoo
2201	2201	2201	copy annan	negative	കോപി അന്നന	Angry Anna
2202	2202	2202	Pandi rajaye malarthi adichu athanu lal magic	negative	പണ്ഡി രാജയേ മലാര്ഥീ ആദിച്ചു അതാനും ലാല് മഗ	Pandi King Malarthy Aadi And that too Lal Mag
2203	2203	2203	Poli poli poli .... am waiting..	positive	പോളി പോളി പോളി  ആമ വൈറ്റിങ്	Polly Polly Polly tortoise Whiting
2204	2204	2204	Lalelattanum raju ettanaumulla oru film kure kalamayi aagrahichirunnu  athu nadannathilulla santhosham pinne parrayanundo🤩🤩🤩🤩🤩	positive	ലാലേലത്താനുംമ രാജു ഏട്ടനഉമുല്ലാ ഓരു ഫിലമ കുരേ കലാമഈ ആഗ്രഹിചീരുനനു  അതു നദന്നാഥീലുല്ലാ സംഥോഷമ പിന്നേ പാര്രായനുംന്ദോ	Lalelamthanumma Raju Etanaumulla one Filma Kure Kalamaee For wishful thinking that Nadannathilulla happiness Then Parrayanando
2205	2205	2205	Poliiiii oru rekshem illa katta waiting	positive	പോലഈ ഓരു രേക്ഷേമ ഇല്ലാ കട്ടാ വൈറ്റിങ്	like one Rekshema no Kata Whiting
2206	2206	2206	Dislike adicha oombanmaarude shraddhakku....  Kittiya collectionum kondu oodikko  Chekuthan ninte ettane eduthittu oookkunnund  Adyam avante kunna vayileduthu ethane rakshikk	negative	ഡിസ്ലീകേ ആദിചാ ങ്ബനമാരുഡ ശ്രദ്ധാക്കും  കിത്തിയ കോള്ലക്ഷനുംമ കോണ്ടു ഒഡിക്കോ  ചേകുതന നീന്റ ഏത്റാനേ ഏദുഥീത്തു ഔക്കുന്നുംദ  ആദ്യമ അവന്ത് കുന്നാ വാഈലേദുതും എഠാനേ രാക്ഷിക്ക	Dislike Adicha Ngbanamaruda Will pay attention Kitia Collection Condo Odiko Chekutana your Which one? Edutheethu Aukunumda First daughter he The hill Vaeeledutum Ethan protect
2207	2207	2207	369 dislike myrol ikka uyir haters myr	negative	369 ഡിസ്ലീകേ മൈരോള് ഇക്കാ ഉയീര ഹാട്ടര് മര	369 Dislike Myrol Ika tall Hatter tree
2208	2208	2208	Telugu film pole masss  trailer	positive	ടെലുഗു ഫിലമ പോല മാസ  ട്രേല്ര്	Telugu Filma like month The trailer
2209	2209	2209	Hindu kalku mahiravan islaminu ebileesu christianikalkku LUCIFER	positive	ഹിന്ദു കാല്കു മാഹിരാവന ഇസ്ലാമിനും ഏബിലിസു ക്രിസ്ത്യാനീകാലക്കും ലുസീഫര	Hindu foot Mahiravana And for Islam Abilisu Even in the Christian era Lucifera
2210	2210	2210	Mohanlal fansinte full spprt ikka pwlichadukk .	positive	മോഹനലാല ഫംസീന്റ ഫുഅല സ്പ്പ്ര്ട്ട് ഇക്കാ പ്വ്ലീചാടുക്ക 	Mohanalala Fumcinta Fuala Spurt Ika Pvleechadukka
2211	2211	2211	Maranamass item ente ponno  ijjathi	positive	മാരണമസ ഇതേമ ആന്റ് പോനനോ  ഇജ്ജാഥീ	Marana Masa The same Ant Don&#39;t go Ijjathi
2212	2212	2212	Happy birthday  ikka movie polkikum....	positive	ഹേപ്പീ ബീരദയ  ഇക്കാ മോവീഏ പോലകികുമ	Happy Biradaya Ika The movie Like
2213	2213	2213	entay ponnoo kola kolli item vannu makkaleay	positive	എന്ട്യ പോന്നൂ കോലാ കോല്ലീ ഇതേമ വനനു മക്കാലേയ	whether go Koala Collie The same to the forest Macaulay
2214	2214	2214	mass aaan ikka ninga vere level aan	positive	മാസ ആന ഇക്കാ നിംഗാ വേരാ ലെവല് ആന	month elephant Ika Ninga Vera level elephant
2215	2215	2215	laletta movie kku super response aanalloo	positive	ലാലെട്ടാ മോവീഏ ക്കു സൂപ്പര് റിസ്പോണ്സ് ആനാല്ലൂ	Laletta The movie to Super Response It&#39;s not
2216	2216	2216	Mass itom. Mass dialogue. Lalettan polikum	positive	മാസ ഇതോമ മാസ ദീഅലോഗു ലാലെത്തന പോളികുമ	month This is it month The dialogue Lalethana Polykuma
2217	2217	2217	Arokke endokke paranjalum ingal Mmale changan Dileepetta	positive	അരോക്കേ എന്ടോക്കേ പരംജലുംമ ഇന്ഗല മ്മലേ ചംഗന ദിലിപെട്ടാ	Arokay What is it? Paramjalumma Engala We are Changana Dilipetta
2218	2218	2218	Ee dislike adichavarde sredhayk enna kanditta enth mosam kanditta dislike adichathenn koode parayamo?	negative	ഈം ഡിസ്ലീകേ ആദിചവാര്ഡ സ്രേധായക ഏനനാ കന്ദിത്താ ഏംത മോസമ കന്ദിത്താ ഡിസ്ലീകേ ആദിചാതേന കൂഡേ പരായമോ	Ahem Dislike Adichawarda Sredhayaka Enana Kandita Emma summer Kandita Dislike Adichatena Also read
2219	2219	2219	Pakaram vaikkan..ellatha prathibha....lal.... njan paranjathu sheriyalle...plse like	positive	പകാരമ വൈക്കനേല്ലതാ പ്രഥീബലാല് ന്ജന പരന്ജാതും ശെരീയലെപ്ല്സ് ലീകേ	Pakarama It&#39;s not too late Prathibalal Njana Paranjam too Linear Apples Leakey
2220	2220	2220	mohanlal ingnanu kure chavar pole irakkilla .vanalo...odukkathe varavaakum..luv u laletta	positive	മോഹനലാല ഇംഗ്നാനും കുരേ ചാവര പോല ഇറാക്കില്ലാ വനലൂടുക്കതേ വരവാകുമ്ലവ ഉ ലാലെട്ടാ	Mohanalala And Ingnan Kure Chavara like Not Iraq Go to the forest On arrival U Laletta
2221	2221	2221	Deslike adicha ella punnara makkalkum nanni	negative	ഡിസ്ലീകേ ആദിചാ ഏല്ലാ പൂന്നാരാ മക്കാല്കുമ നാന്നീ	Dislike Adicha Ella Poonnaara Makalkuma Nannie
2222	2222	2222	Poli padam njn ella mammooty movies kanarundu itrekku disapointed akkiya oru movie aduthundayittilla	negative	പോളി പദമ നജന ഏല്ലാ മമൃഊടി മോവീസ കനാരുംദു ഇട്രക്കും ഡിസപോയിന്റ്ദ അക്കീയാ ഓരു മോവീഏ അദുഥുന്ദയിത്തില്ലാ	Polly Padma Najana Ella Mamruodi Mowisa Kanarumdu And the truck Disappointment Akiya one The movie Aduthundayitilla
2223	2223	2223	Freezerinakathulla scene kandappo arkenkilum hollow man film orma varunnundo	neutral	ഫ്രീചേരീനാകാതുല്ലാ സീന കന്ദാപ്പോ അര്കേന്കീലുമ ഹോളോ മന ഫിലമ ഓര്മാ വരുന്നുന്ദോ	Can&#39;t be free Seena Kandapo Arkenkiluma Hello Mana Filma remember Are you coming?
2224	2224	2224	Aah nalla best marakkar...sound kettal thanne ariyam...ithu adutha neeraliyo odiyano aavanulla laksham aanu...daivame ee pulli ithu enthinulla purapadu aanu...🤣	negative	ആ നല്ലാ ബെസ്റ്റ് മാരക്കര്സൌണ്ട് കേട്ടല ഠാന്നേ അരിയമിതും അദുഥാ നീരലിയോ ഓദീയാനോ ആവാനുല്ലാ ലക്ഷമ ആനുദൈവാമേ ഈം പുല്ലീ ഇതു എന്ഥീനുല്ലാ പുരാപദു ആനു	That good Best Markersound don&#39;t listen Thane Ariamitum Adutha Niralio Odiano Not to be Lakshma Oh God Ahem Pulley This Why not? Purapadu Anu
2225	2225	2225	Muppathil kooduthal thavana kanda njanalle sherikkum mess	positive	മുപ്പതില കുദുതല താവാനാ കംദ ന്ജനാല് ശേരീക്കുംമ മെസ്സ്	thirty skull Tawana Kamda Njanal Shareekumma Mess
2226	2226	2226	avasanam kanjipole aavathirunal mathi all the best	neutral	അവസനമ കാന്ജീപോല ആവതീരുനല മഥീ എല്ല ദ ബെസ്റ്റ്	The ending like kanji Avathirunala Matthew Ella The Best
2227	2227	2227	Oru tamil movie touch pole. Expect to be a good movie	positive	ഓരു തമിഴ് മോവീഏ ടൂച പോല എക്സ്പെക്ട് ടോ ബേ ആ ഗുഡ് മോവീഏ	one Tamil The movie Toocha like Expect To Bay That Good The movie
2228	2228	2228	Pulimurugan pole akkan ulla udesham bt release kazhinj parayam kollavo elliyo enn	neutral	പുലിമുരുഗന പോല അക്കന ഉല്ലാ ഉദേശാമ ബ്ത റേലീസ് കാഝ്ഹീംജ പരായമ കൊല്ലവോ എല്ലിയോ ഏന	Pulimurugana like Akana Ullah Udesama Bt Raleigh&#39;s Kajheemja parayama kill Ellio Ena
2229	2229	2229	Polichu	positive	പോളിചു	Polichu
2230	2230	2230	Padam kanditt veendum trailer kaanan vannavar aarengilum undo enne pole	positive	പദമ കന്ദിത്ത വേംദുമ ട്രേല്ര് കാനന വന്നാവര ആരേഗിലുമ ഉന്ഡോ ഇന്നേ പോല	Padma Kandita Venduma The trailer Canon comers Someone undo today like
2231	2231	2231	Ith kalki allaa ith kathi aahnu itiri	neutral	ഇത കല്കീ അല്ലാ ഇത കഥീ ആഹനു ഇതിരി	This Kalki no This The story Ah Itiri
2232	2232	2232	Swantham panavum padavum aauapol experimentation undavumo;)	neutral	സ്വംതമ പനവുംമ പദവുംമ ആഔപോല എക്സ്പേരിമന്റേഷന് ഉന്ദാവുംമോ	own Panumma word As if For experimentation Are you happy?
