	Unnamed: 0	Unnamed: 0.1	sentence	sentiment	transliteration	translation
677	677	677	Eganegilum 12 aam thiyathi aaya mathiyaayirunnu katta waiting	positive	ഏഗനേഗീലുംമ 12 ആമ തീയാഥീ ആയാ മാംഥീയായീരുനനു കട്ടാ വൈറ്റിങ്	Eganegilumma 12 tortoise fire Aya Manthea Yairuna Kata Whiting
678	678	678	Veendum veendum Vann kaanunnath njan maathramaano	positive	വേംദുമ വേംദുമ വനന കാനുംന്നാഥ ന്ജന മാഥ്രാമാനോ	Venduma Venduma Forestry Kanumannatha Njana Mathramano
679	679	679	Enthaylum... Oru adaar feel undu... Tamil look	positive	എന്തയ്ലുംമ ഓരു അദാര ഫീല ഉണ്ഡു തമിഴ് ലൂക	And what? one Adara Phila undu Tamil Luke
680	680	680	68 tikayunna youthanu veendum oru perunnal sammanam prisharadi vaka..	positive	68 തീകയുംന്നാ യൌതാനും വേംദുമ ഓരു പേരുന്നല സമ്മനാമ പ്രീശാരദി വാകാ	68 Will it burn? and youth Venduma one name Sammanama Presharadi word
681	681	681	Pwoli trailer sunny chechiii istam ikka jeevanaanu	positive	പ്വോലി ട്രേല്ര് സുനയ ചേചീ ഇസ്തമ ഇക്കാ ജീവനാനു	Powley The trailer Sunaya sister isthma Ika for life
682	682	682	padam hit.....pani ariyavunnavar film pidichal trailer kandalum goosebumps varum	positive	പദമ ഹിത്പനീ അരീയാവുംന്നാവര ഫിലമ പിദിചല ട്രേല്ര് കന്ദലുംമ ഗൂസിബമ്പ്സ് വരുമ	Padma Hitpanee Ariyavumnnavara Filma Pidichala The trailer Kandalumma Goosebumps will come
683	683	683	L.. Prithviraj  lalettanilude oru adaar item thanne kond vanno...	positive	ല പ്രീഥ്വീരാജ  ലാലെട്ടാനീലുഡേ ഓരു അദാര ഇതേമ ഠാന്നേ കോണ്ട് വനനോ	La Prithviraj Laletaniluidae one Adara The same Thane Cont Vanano
684	684	684	Adipoli trailer movie kanan wi8ing. oru psycho indannu prathishikaam	positive	ആദിപോലി ട്രേല്ര് മോവീഏ കാനന വി8ഇംഗ് ഓരു സൈകോ ഇന്ഡാനനു പ്രഥീശീകാമ	Adipoli The trailer The movie Canon V8ing one Psycho to Indonesia Pratheeshikama
685	685	685	Ikka fan aanne  Ennalum parayuva kolakolli item	positive	ഇക്കാ ഫന ആനേ  എന്നലുംമ പരയുവാ കോലാകോല്ലീ ഇതേമ	Ika Fana oh but also Parayua Colakollee The same
686	686	686	Puli ooodu kandam vazhi ooodan paray ipozhe	negative	പുലി ഉഡു കംദമ വാഝ്ഹീ ഊദന പരായ ഇപോഝ്ഹേ	the tiger Udu Kandama Wajhi Blow Paraya Ipojhe
687	687	687	Ithe kandirikkum enn ullvar like itte pokko 🤨	positive	ഇഈം കന്ദിരീക്കുംമ ഏന ഉല്ല്വാര ലീകേ ഇത്സ പോക്കോ 	Eem Kandirikumma Ena Ullwara Leakey And so on go
688	688	688	Njan laletten fananu ...  pakshe trailer kandu romam enittu nikkinnu	positive	ന്ജന ലാലെട്ടേന ഫനനു   പക്ഷേ ട്രേല്ര് കാണ്ഡു രോമമ ഇനീത്തു നിക്കീനനും	Njana Lalettena Fanon But The trailer Kandu fur Ineethu Nicene too
689	689	689	ikka and rajuettan... uff goose bumps	positive	ഇക്കാ ആന്റ് രാജുത്തന ഉഫ്ഫ ഗൂസ ബുമ്പ്സ്	Ika Ant Rajuthana Phew Guza Bumps
690	690	690	Sound athu screenil kanam  lalettan polikkum	positive	സൌംദ അതു സ്ക്രീനീല കനാമ  ലാലെത്തന പോലിക്കുംമ	Soumda that screen Kanama Lalethana Pollykumma
691	691	691	Ine lucifar  loosaavum  illenkil raaja loosakkum ntammo kidu mammookka	positive	ഇന് ലുസിഫര  ലൂസാവുംമ  ഇല്ലേന്കീല രാജാ ലൂസക്കുംമ ന്താമ്മോ കിഡു മമൂക്കാ	In Lucifer Lusavumma No way the king Luzakumma What&#39;s up? Kidu Momoka
692	692	692	Uff Mammookka'$ entry BGM Stunning trailer	positive	ഉഫ്ഫ മമൂക്കാ ആന്ട്രി ബ്ഗ്മ സ്തുന്നിംഗ് ട്രേല്ര്	Phew Momoka Entry Bgma stunning The trailer
693	693	693	Evideyo miss aaya pole pazhaya lalettane thirichu kittiya pole..thaadi vecha pinne..payyan pwoli alle....luv u. .Lalettaa...	positive	ഏവീദേയോ മീസ്സ ആയാ പോല പഝ്ഹായാ ലാലെട്ടാനേ ഥീരീചു കിത്തിയ പോലേഥാദീ വേചാ പിന്നേപ്പായയാന പ്വോലി അല്ലേലവ ഉ ലാലെട്ടാ	Anyhow Mesa Aya like Pajhaya Lalettan Theerichu Kitia Like wait Back to back Powley Other U Laletta
694	694	694	Nt ikka ingalu verm ikka allatto ponnikkaya  #romanjified	positive	ന്റ് ഇക്കാ ഇന്ഗാലു വേര്മ ഇക്കാ അല്ലട്ടോ പോന്നീക്കായാ  റോമന്ജീഫീഏദ	Nt Ika Ingalu Verma Ika Isn&#39;t it Have you gone? Romangephiaeda
695	695	695	Immathiri mass  Last aa chadi idi super Ethu polikkum  Ikka um pillareum triple  Strong aaa	positive	ഇമ്മാംഥിരീ മാസ  ലാസ്റ്റ് ആ ചാദീ ഇദി സൂപ്പര് ഏതു പോലിക്കുംമ  ഇക്കാ ഉമ പില്രിയമ ത്രിപ്ല്  സ്ട്രോംഗ് ആ	Imam Thiri month Last That Chadee Idi Super Which Pollykumma Ika Uma Pilriyama triple Strong That
696	696	696	Anttemoo anthayith akkee kudee oru koritharip	positive	ആന്റ്റീമൂ അന്തയീത അക്കീ കുദീ ഓരു കോരിഥാരീപ	Antimu Endless Aki Kudee one Koritharipa
697	697	697	Prithividae padam nalla kaaryam but manju indallo  .. pottumennu urappu!	neutral	പ്രീഥീവീദഏ പദമ നല്ലാ കാര്യമ ബുത മംജൂ ഇന്ഡാല്ലോ   പോട്തുമേന്നു ഉറാപ്പു	Prithiveda Padma good matter Wednesday Manju Indallo It&#39;s old Urapu
698	698	698	Aa chekkan polikan ulla ella chance um kanunnund	positive	ആ ചേക്കന പോളികാന ഉല്ലാ ഏല്ലാ ചാന്സ് ഉമ കനുംന്നുംദ	That Chekana Polycana Ullah Ella Chance Uma Kanunnunda
699	699	699	Superb Laletta .....Love you lotsssss......Othiri ishtam Lalettane	positive	സൂപ്പര്ബ് ലാലെട്ടാ ലവ യൂ ലോത്സോഥീരീ ഇശ്തമ ലാലെട്ടാനേ	Superb Laletta Love Yu Lotsotheory Ishtama Lalettan
700	700	700	Ithinokke dislike adichavanmare okk adichu kollanamm ettan uyirr	negative	ഇതീനോക്കേ ഡിസ്ലീകേ ആദിചവന്മരേ ഓക്ക ആദിച്ചു കൊല്ലനാമ്മ ഏത്തന ഉയിറ്ര	Look at this Dislike Adi Chavanmar Oka Aadi Kollanamma What is it? Utra
701	701	701	Ikka poliyhanu ithreyum prayathil inghanew okke nikkunillew ikka vere level annu poli ahh ikka	positive	ഇക്കാ പോളിയ്ഹാനു ഇത്രേയുംമ പ്രയാതീല ഇന്ഘനേ ഓക്കേ നിക്കുംനില്ല ഇക്കാ വേരാ ലെവല് അന്നു പോളി അഹ ഇക്കാ	Ika Polyyhanu That&#39;s all Prayatheela Inghan okay Neither do you Ika Vera level that day Polly Ah Ika
702	702	702	Ayippan poli an muthe ni an muthe hero ayappan fans like	positive	അയിപ്പന പോളി ആന മുത നീ ആന മുത ഹീരോ അയാപ്പന ഫംസ ലീകേ	sending Polly elephant Muta you elephant Muta Hero Ayapana Phamsa Leakey
703	703	703	Odi vidyakal kannan kathu nilkukyanu laletta	positive	ഓഡീ വിദ്യാകല കന്നന കതും നീല്കുക്യനു ലാലെട്ടാ	Audie Education Kannana and the letter Nilkukya Laletta
704	704	704	Potta padam 2million views polum illatha ee oola padam potti paaleesavum.  Antony perumbaavoor kuthuvaala Edukentiverum. {not an ikka fan}	negative	പോട്ടാ പദമ 2മിലിഓന് വിഏവ്സ പോലുംമ ഇല്ലതാ ഈം ഊലാ പദമ പോത്തി പാലീസവാമ  അന്റോനി പേരുമ്ബആവൂര കുതുവാലാ ഏദുകാന്തീവേരുമ നട ആന ഇക്കാ ഫന	baby Padma 2 million Vevsa Even No Ahem Oola Padma gone Palisawama Antony Perumbavaora Kutuala Edukantiveruma Walk elephant Ika Fana
705	705	705	Ente anna oru rakshaym ella.... Adipwoli	positive	ആന്റ് അന്നാ ഓരു രക്ഷയ്മ ഏല്ലാ ആദിപ്വോലി	Ant Anna one Salvation Ella Adipvoli
706	706	706	Bgm .. repeat mode .. njan maathram aano?	positive	ബ്ഗ്മ  റേപേട മോഡ  ന്ജന മാഥ്രാമ ആനോ	Bgma Don&#39;t worry Moda Njana Mathrama Ano
707	707	707	Ithilum mikacha trailer swapnangalil mathram	positive	ഇതിലുമ മികാചാ ട്രേല്ര് സ്വപ്നാംഗലില മാതരാമ	In this too Mikacha The trailer No dream Matarama
708	708	708	Mass odiyan Mass kollamass kattaa waiting kidilam	positive	മാസ ഓദിയാന മാസ കൊല്ലമസ കട്താ വൈറ്റിങ് കിദിലമ	month Odiana month Kollamasa Cat Whiting Kidilama
709	709	709	Katta katta katta katta waiting....cant wait man	positive	കട്ടാ കട്ടാ കട്ടാ കട്ടാ വൈറ്റിങ്കാംത വാട മന	Kata Kata Kata Kata Whiteness rent Mana
710	710	710	Daivam oroon kond varum... Ennit pottipoliyum... Verute collection kittan vendiii advertisement🤣🤣🤣🤣🤣🤣🤣🤣🤣🤣🤣🤣🤣🤣	negative	ദൈവമ ഓരൂണ് കോണ്ട് വരുമ എന്നീത പോട്ടിപോലിയുംമ വേരുക കോള്ലക്ഷന് കിത്തന വേന്ദീ അഡ്വര്തിസ്മന്റ്	Goddess It&#39;s okay Cont will come and the Potipoli too take root for the collection kithana Wendy Advertisement
711	711	711	Anthamaaya thaara aaradana aaswadana nilavara thakarchayude soochanayanu. Cinemaye swathanthravum kalaaparavumayi veekshikunna oru yuva janathayeyanu malayala cinemak aavashyam	negative	അംഥാമായ താരാ ആരദനാ ആസ്വാദനാ നീലാവാരാ ഠാകരചയുദേ സൂചനായനു സിനേമയേ സ്വാതാന്ത്രവുംമ കലാപരാവുമയീ വിക്ശീകുന്നാ ഓരു യുവാ ജനാത്യേയനു മലയലാ സിനേമക ആവാശ്യമ	Anthamaya Tara Adana enjoyable Blue Thakarachayude As a hint Cinema Freedom too Artist Vikshikunna one Young Janatyeyan Malayalam cinema need
712	712	712	Entho ishtam aanu ellarkum ee Ittimaniye	positive	എന്ഠോ ഇശ്തമ ആനു എല്ലാര്കുമ ഈം ഇത്തിമാംനിയേ	what Ishtama Anu Everyone Ahem That&#39;s enough
713	713	713	ikkaa polichu.. big b mood poli bgm	positive	ഇക്കാ പോളിചു ബിഗ ബ മൂഡ് പോളി ബ്ഗ്മ	Ika Polichu Biga b Mood Polly Bgma
714	714	714	Machane pwolii item inka pwolikkum.   Thakarkkum	positive	മചാനേ പ്വോലീ ഇതേമ ഇനകാ പ്വോലീക്കുംമ   ഠാകരക്കമ	Machane Powlee The same Inaka Pvolikumma Thakarakama
715	715	715	Kiduvo kidu.... .. onnum parayan illaa ...	positive	കിദുവോ കിഡു  ഓനനുംമ പരായണ ഇല്ലാ 	kiddo Kidu Onanumma Recitation no
716	716	716	Padma innaanu kande	negative	പദ്മാ ഇന്നആനു കംഡേ	Padma today Come on
717	717	717	Ethippoo കൂതറയിലെ   mohanlalinte make over aayinda...	neutral	എതീപ്പൂ കതറയല   മോഹനലാലീന്റ മക ഓവര ആയിംദാ	Reach out Katarayala Mohanalalinta son Overa It is
718	718	718	Laletta adich policho laletta Nigaloru muthaan ie padam Vijayikom nokiko apo	positive	ലാലെട്ടാ ആദിച പോളിചോ ലാലെട്ടാ നികലോരു മുഥാന ഇ പദമ വിജയികോമ നോകീകോ അപോ	Laletta Adicha Polycho Laletta Nicholas Muthana E Padma Winner look Apo
719	719	719	6.4k dislike ... Ijjathii rodhanam annaloo ....	negative	64ക ഡിസ്ലീകേ  ഇജ്ജാതീ രോധനാമ അന്നാല് 	64 k Dislike Ijjati Rodhanama At that time
720	720	720	Powlichu	positive	പോവ്ലീചു	Povlich
721	721	721	LuCIfeR        polichu poli	positive	ലുസീഫര        പോളിചു പോളി	Lucifera Polichu Polly
722	722	722	Soubinum Suraj ettanum polichuuuu padam poliiiii  oru family ayittum kannan pattiya nalla padaaammm	positive	സൌബീനം സൂരജ് ഏത്തനുംമ പോളിചൂ പദമ പോലഈ  ഓരു ഫാമില്യ അയിത്തുംമ കന്നന പത്തിയ നല്ലാ പദാമ്മ	Saubinam Suraj whatever Polychoo Padma like one The family Will you? Kannana ten good Padamma
723	723	723	E... Nanjankottayil aarudeyumkanneroppan vannavanalla njan... Ennal karayikunnavanteyokkry Tala njan adichupolikum...   Kidu kidu kidu mass punch dialouge....	positive	ഏ നംജന്കോട്ടാഇല ആരുദേയുമകാന്നറോപ്പന വന്നാവനല്ലാ ന്ജന എന്നല കാരയീകുന്നവന്തേയോക്ക്രി താലാ ന്ജന ആദിച്ചുപോലികുമ   കിഡു കിഡു കിഡു മാസ പഞ്ച് ദീഅലൌഗേ	A Namjankota leaf Arudeyumakannaropana Not the one who came Njana Enala Who cares Tala Njana Adichupolikuma Kidu Kidu Kidu month Punch De Alauge
724	724	724	Mammokka Ennum oru lahariyaanu.Annum Ennum athbudappeduttiyittey ullu. Padam oru vambhan hittakum..minimum 250cr  kadakkum..lookam vaaythum mammotty enna	positive	മമോക്കാ എന്നമ ഓരു ലഹരീയാനുആന്നമ എന്നമ അഥ്ബുഡാപ്പേദുത്തിയിത്തേയ ഉല്ലു പദമ ഓരു വാമ്ഭാന ഹിത്തകുമ്മീനിമുമ 250ക്ര്  കദക്കുംമാംഊകാമ വായ്തുമ മമ്മോട്ടി ഏനനാ	Mamoka Name one Intoxicating Name Athbudapeduthiiteya Chili Padma one Vambhana Hithakumminimuma 250 cr Kadakummamookama Vaituma Mammootty Enana
725	725	725	Acting ഒരു രക്ഷയും illa.... baki illathoke pinne	positive	ആക്ടിംഗ് ഒര രകഷയ ഇല്ലാ ബകീ ഇല്ലാഥോകേ പിന്നേ	Acting a Rakshaya no the rest Illathoke Then
726	726	726	Ivide Palakkad Jayettan Fans club nnu ashamsakal!!! Adichal romam ennikum athaanu Thrissur pooram	positive	ഇവിഡ് പലക്കാദ ജയേത്തന ഫംസ ക്ലബ് നനു അശമസാകല ആദിചല രോമമ എന്നീകുമ അഥാനു ത്രീസഉര പൂരമ	Evid Many times Victory Phamsa Club Nanu bad luck Adichala fur Namely Athanasius Trisaura Purama
727	727	727	പടം പൊളിക്കും HBD mammokka       By Die hard ettan fan	positive	പട പളകക ഹ്ബ്ദ മമോക്കാ       ബി ഡീ ഹാര്ഡ ഏത്തന ഫന	Army don&#39;t panic Hbda Mamoka B Dee Harda What is it? Fana
728	728	728	Mobile phonil kadapoolee ekkane ??appole theateril anakilo	neutral	മൊബൈല് ഫോനീല കാദ്പൂലീ ഏക്കാനേ അപ്പോള് തിയേതേരില അനകിലോ	Mobile Foneela Kadpoolee Alone then There is no theater Anakilo
729	729	729	Onnum parayan illa laletta u trigger again ...	positive	ഓനനുംമ പരായണ ഇല്ലാ ലാലെട്ടാ ഉ ത്രിഗ്ഗേര അഗൈന 	Onanumma Recitation no Laletta U Trigger Again
730	730	730	Dae Ajithaaa copy adikathada Mohan Lal	negative	ദഏ അജീതആ കോപി ആദികതാദാ മോഹന ലാല്	Yes Ajeeta Angry At first Mohana Lal
731	731	731	Gilla plus loham plus ramaleelaa...naariya kopi adiii	negative	ഗില്ലാ പ്ലൂസ് ലോഹമ പ്ലൂസ് രാമലീലാനാരിയാ കോപീ ആദീ	Gilla Plus metal Plus Ramalilanaria Copy Adee
732	732	732	Dear Mammookka	positive	ദിര മമൂക്കാ	Dira Momoka
733	733	733	Onnil kuduthal kanda trailer ambooo powli....	positive	ഓനനീല കുദുതല കംദ ട്രേല്ര് അംബൂ പോവലീ	onanila skull Kamda The trailer Amboo Powlee
734	734	734	Ramesh pisharadi aanu director ennu kettapo valippu padam aakumennu karuthi..trailer kandapo mosamakilla ennoru prithisha vannu..	neutral	രമേശ പീശാരദി ആനു ദിരേക്ടര് എന്നു കേട്ടാപോ വാലിപ്പു പദമ ആകുമേനനു കരുതിത്രേല്ര് കംദാപോ മോസമാകില്ലാ എന്നോരു പ്രീഥീശാ വനനു	Ramesh Peesharadi Anu Director that Do you hear Valipu Padma Akumenon Think about it Kamdapo Can&#39;t be bad Someone Pritheesha to the forest
735	735	735	Official trailer release aakunnathinu mumbe dislike adikkan kure mammunni fans oolakal..	negative	ഓഫീസിയാല ട്രേല്ര് റേലീസ് ആകുന്നാഥീനും മുംബ് ഡിസ്ലീകേ ആദിക്കന കുരേ മമ്മുന്നീ ഫംസ ലാകല	Officially The trailer Raleigh&#39;s Akunnathin too Mumb Dislike Adhikana Kure Mummy Phamsa Lakala
736	736	736	As a mammokka fan trailer kidukki padam nalla oru vijayamayi theeratte	positive	ആസ ആ മമോക്കാ ഫന ട്രേല്ര് കിടുക്കി പദമ നല്ലാ ഓരു വിജയാമയീ ഥീരറ്റ്	Asa That Mamoka Fana The trailer Got it Padma good one Victory Theoret
737	737	737	Youtube hang avan ready ayiko L	positive	യൌതുബേ ഹംഗ അവന രേഡ്ഡ്യ അയീകോ ല	YouTube Hanga He Reddya come on La
738	738	738	ippo mansilai e padam 8 nilayil pottum	negative	ഇപ്പോ മാനസീലാഈ ഏ പദമ 8 നീലാഇല പോട്ടമ	now Manaseelaee A Padma 8 blue leaf potama
739	739	739	Onnu urappa full entertainment movie yaa.. Yente ponnu ikka fans onnu kaddak pidichaal oru blockbuster engu poorum ....	positive	ഓനനു ഉരപ്പാ ഫുഅല ആന്റര്ത്ന്മെന്റ് മോവീഏ യാ യേന്ത് പോനനും ഇക്കാ ഫംസ ഓനനു കദ്ദക പിദിചാല ഓരു ബ്ലാക്ക്ബസ്റ്റര് ഇംഗൂ പൂരുമ 	Onanu Urappa Fuala Entertainment The movie ya what Ponan too Ika Phamsa Onanu Kadaka Pidichala one Blackbuster Ingoo Puruma
740	740	740	Lalettan - Prithivi combo vera level...  Pwolichu Lalettan & Prithivi fans like adiku makkale	positive	ലാലെത്തന  പ്രീഥിവീ കംബോ വേരാ ലെവല്  പ്വോലിചു ലാലെത്തന  പ്രീഥിവീ ഫംസ ലീകേ ആദികു മക്കാലേ	Lalethana Prithivi Combo Vera level Polichu Lalethana Prithivi Phamsa Leakey Adiku Macaulay
741	741	741	Mammooka die Hard fans LIKE adichu polikk ith logam kaathu ninna RAJA yude varav ith polikkum	positive	മമൂകാ ഡീ ഹാര്ഡ ഫംസ ലീകേ ആദിച്ചു പോലിക്ക ഇത ലോഗമ കാതും നീന്നാ രാജാ യുഡേ വരവ ഇത പോലിക്കുംമ	Momoka Dee Harda Phamsa Leakey Aadi Polka This Logama And the ear Neena the king Uday arrival This Pollykumma
742	742	742	29K Dislike adichavar Padam kandu kaanum lo... Oro Dhurendhangal...	negative	29ക ഡിസ്ലീകേ ആദിചവര പദമ കാണ്ഡു കാനുംമ ലോ ഓരോ ധുരേന്ധംഗല	29 k Dislike Adi Chavara Padma Kandu Kanuma Lo each Durendhangala
743	743	743	Alinje polinja trailer.. odiyan aakumo ?? 🤓🤓	negative	അലിന്ജേ പോളിന്ജാ ട്രേല്ര് ഓദിയാന ആകുമോ  	Alinje Polinja The trailer Odiana Will it be
744	744	744	Dialogue pora msmmookka paranjaal onnoode ushaaraayene	negative	ദീഅലോഗു പോരാ മസ്മാംഊക്കാ പരംജആല ഓംനൂഡേ ഉഷാരായേന	The dialogue not enough Masmamooka Paramjaala Omniday Usharayena
745	745	745	trailer kidukki look at the likes	positive	ട്രേല്ര് കിടുക്കി ലൂക ആട ദ ലീക്സ്	The trailer Got it Luke dress The Leeks
746	746	746	38k views 20k like polichu	positive	38ക വിഏവ്സ 20ക ലീകേ പോളിചു	38 k Vevsa 20 k Leakey Polichu
747	747	747	Tovino.Namak uruttane... Ayyyo adipoki mass muvi ayrkum katta waiting	positive	ടോവിനോനാമക ഉരുത്താനേ അയ്യോ ആദിപോകി മാസ മുവീ ആയര്കുമ കട്ടാ വൈറ്റിങ്	Towinonamaka Uruthan Oops Adipoki month The movie Ayarkuma Kata Whiting
748	748	748	Direction maarakam prituiraaj nee tanne cheytathaano atho ariyunnavare kondu cheyyichathaano aaraayaalum massayittundu Well job man	positive	ദിരേക്ഷന് മാരാകാമ പ്രീതുഇരാജ നീ തന്നേ ചേയ്തഥാനോ അതോ അരീയുംന്നാവരേ കോണ്ടു ചേയ്യീചതാനോ ആരായാലുമ മാസ്സയിത്തുണ്ഡു വേല ജോബ് മന	Direction Maracama Preetuiraja you Yes Cheitathano Or Aree also Condo To chew Whoever Massaithundu the work Job Mana
749	749	749	Ichayan kasari. Kiduki. Porich. Njgal tcr karude swagraya ahagaram	positive	ഇഛായന കസരി കിദുകീ പോരീച ന്ജ്ഗല് തര കരുഡേ സ്വാഗ്രയാ അഹഗരാമ	Ichayana Kasari Kidukee Poricha Njgal type Caruday welcome Ahagarama
750	750	750	King is oll ways king 🤙  ഏട്ടൻ ഇഷ്ട്ടം	positive	കിംഗ് ഇസ ഓള്ല വാട കിംഗ്   ഏടടൻ ഇഷടട	King Isa Ola rent King Eighteen Ishada
751	751	751	Amitha pratheesha vekunila anyway katta waiting #L	neutral	അമിതാ പ്രഥീശാ വേകുനീലാ അന്യവഏ കട്ടാ വൈറ്റിങ് ല	Amita Pratheesha Vekunila Others Kata Whiting La
752	752	752	Nenjinakath Lalettan Nenjuvirich kond parayum numma oru lalettan fan anenn _______________katta waiting	positive	നേന്ജീനാകത ലാലെത്തന നേന്ജുവീരീച കോണ്ട് പരയുംമ നുംമ്മാ ഓരു ലാലെത്തന ഫന അനേന്ന കട്ടാ വൈറ്റിങ്	Nenjeenakata Lalethana Typhoid fever Cont Parayumma Mumma one Lalethana Fana Anenna Kata Whiting
753	753	753	sathyam paranjaal trailer oru maja illaa	neutral	സത്യമ പരംജആല ട്രേല്ര് ഓരു മാജാ ഇല്ലാ	Satyama Paramjaala The trailer one Maja no
754	754	754	Padam average filim mathrameyullu fansukar pokkiparayunna rasamonnum padathinnillaa	neutral	പദമ അവേരാഗ് ഫിലീമ മാഥ്രമേയല്ലൂ ഫംസുകര പോക്കിപരയുംന്നാ രസമോനനുംമ പദതീന്നീല്ലാ	Padma Average Filma Not only Phamsukara Pokiparaumna Rasamonan too Wordless
755	755	755	Vannu vannu avan vannuIkka love yuu	positive	വനനു വനനു അവന വന്നുക്കാ ലവ യൂ	to the forest to the forest He don&#39;t come Love Yu
756	756	756	Evdeyokkeyooo Oru pulimurugan...dadi Girija.. Fight.. Music...... Evdeyokkeyooo 🤔🤔🤔	neutral	ഏവ്ദേയോക്കേയൂ ഓരു പുലിമുരുഗംദാദീ ഗിരിജാ ഫൈറ്റ് മ്യൂസിക് ഏവ്ദേയോക്കേയൂ 	Every day one Pulimurugam Dadee Girija Fight Music Every day
757	757	757	Happy birthday mammukka  gana gandharvan polichadukkum next block bluster	positive	ഹേപ്പീ ബീരദയ മമ്മുക്കാ  ഗനാ ഗന്ധര്വന പോളിചാടുക്കുമ നെക്സ്ട് ബ്ലാക്ക് ബ്ലുസ്റ്റര്	Happy Biradaya Momma Ghana Gandharvana Polychadukuma Next Black Bluster
758	758	758	Nte ponnnoooo enthaaa makkkale immmale ikkkkade aaa oru idh🥰🥰🥰	positive	നീം പോന്നൂ ഏന്ഥാ മക്കാലേ ഇമ്ബാലേ ഇക്കാഡ് ആ ഓരു ഇധ	Neem go what Macaulay Imbale Icad That one Idha
