	Unnamed: 0	sentence	sentiment	translation
2115	2115	Thakarthu Jayettaa..  katta waiting for Pullu Giri n Team	positive	Thakarthu Jayettaa.. katta waiting for Pullu Giri n Team
2116	2116	Guest role aanu ..athinu eni valiya thallu venda....	negative	Guest role aanu ..athinu eni valiya thallu venda....
2117	2117	Onnum parayan illa polich adakki mammookka	positive	Onnum parayan illa polich adakki mammookka
2118	2118	youva thara nirayil eni yeattavum muzhangi keelkkunnath tovinoyude Peru aayirikkum...	positive	youva thara nirayil eni yeattavum muzhangi keelkkunnath tovinoyude Peru aayirikkum...
2119	2119	Film kandu.....Nalla movie aan dharyam ayi book cheythoolu🤗	positive	Film kandu.....Nalla movie aan dharyam ayi book cheythoolu🤗
2120	2120	Gopisunder pulimurukan eduthappozulla music padangal onnum marnnittia...engu rajayil eathinilkumbazum..elllam oruikalkudui avatharippikunnondu	negative	Gopisunder pulimurukan eduthappozulla music padangal onnum marnnittia...engu rajayil eathinilkumbazum..elllam oruikalkudui avatharippikunnondu
2121	2121	Trailer pwoli ............... .25	positive	Trailer pwoli ............... .25
2122	2122	Trailer...kozhapila.....cinemayum nallatai vernam....pritvirajine viswasam Anu....but murali gopy story ayond Oru pedi	neutral	Trailer...kozhapila.....cinemayum nallatai vernam....pritvirajine viswasam Anu....but murali gopy story ayond Oru pedi
2123	2123	Video kanunnathu munne comments aanunokye  ath kndple video sPrb aavummnnuthonni  powli  kAtta waiting fOr LUCIFER	positive	Video kanunnathu munne comments aanunokye ath kndple video sPrb aavummnnuthonni powli kAtta waiting fOr LUCIFER
2124	2124	Katta waiting lalettaaaaa2' nd on trending kuwait	positive	Katta waiting lalettaaaaa2' nd on trending kuwait
2125	2125	Oru rekshayum illa......katta waiting......mathukutty mike kondu maathram alla camera kondum njettichu kalanjirikkunnu	positive	Oru rekshayum illa......katta waiting......mathukutty mike kondu maathram alla camera kondum njettichu kalanjirikkunnu
2126	2126	Thallu vidunna moopanu pakaram appan  Daddy girija  Peter hein fight ( parannadi) Pulikk pakaram patti  Pinne mainayum same costume (Anushree)  .	negative	Thallu vidunna moopanu pakaram appan Daddy girija Peter hein fight (parannadi) Pulikk pakaram patti Pinne mainayum same costume (Anushree) .
2127	2127	Kgf movie kanda pola oru feel..... Endhayalum laleta kalakki	positive	Kgf movie kanda pola oru feel..... Endhayalum laleta kalakki
2128	2128	Cinemakal koodumthorum age kuranju varuvanalloo.. Kidu look..  HBD IKKA	positive	Cinemakal koodumthorum age kuranju varuvanalloo.. Kidu look.. HBD IKKA
2129	2129	Mamangam marana mass akum allathe pinne	positive	Mamangam marana mass akum allathe pinne
2130	2130	Ithu njangal polichadukkum. Love you latetta.....	positive	Ithu njangal polichadukkum. Love you latte.....
2131	2131	Raja trailer nu oru pulimurugan touch.. #goosebumps	positive	Raja trailer nu oru pulimurugan touch.. #goosebumps
2132	2132	Raju ettan kurve  nallonm thonnunde	negative	Raju ettan kurve nallonm thonnunde
2133	2133	Oru njettalum illa romanjavum illa ayye	negative	Oru njettalum illa romanjavum illa ayye
2134	2134	Padam kand trailer kanuvan vannvar undo..poli film	positive	Padam kant trailer kanuvan vannevar undo..poli film
2135	2135	Nairmare vendannu paranja Kallamark kanich koduk ...Nairmarude karuth...lalettan and prithivi...tholpikkanam ee electinu....	negative	Nairmare vendannu paranja Kallamark kanich kodu ...Nairmarude karuth...lalettan and prithvi...tholpikkan ee electinu....
2136	2136	Mammookka  love you ikkayanu loka ithihasa nayakan kolakomban...	positive	Mammookka love you ikkayanu loka ithihasa nayakan kolakomban...
2137	2137	Dislike adikkunnna 12 k kundanmare poyi ooombikkolu adhey nadkkuuu nanamkettttav hijadagal	negative	Dislike adikkunnna 12 k kundanmare poyi ooombikkolu adhey nadkkuuu nanamkettttav hijadagal
2138	2138	lalettan screen presence 100 percent in trailer. Lalettan politics and actionil thakarkkum ennullavar like adi........	positive	lalettan screen presence 100 percent in trailer. Lalettan politics and actionil thakarkkum ennullavar like adi........
2139	2139	Last oottam kanddo makkale onnum parayaan illa aaa face lle mattam anergy uff powlikkum ikkaaa	positive	Last oottam kanddo makkale onnum parayaan illa aaa face lle mattam anergy uff powlikkum ikkaaa
2140	2140	Pala bgm um ketta pole thonnunundelum kidu feel	neutral	Pala bgm um ketta pole thonnunundelum kidu feel
2141	2141	Polichu  Pakka Oru Telugu Thriller Movie Pole Und.. Enthayalum Lucifer Theater Polichadukkam...	positive	Polichu Pakka Oru Telugu Thriller Movie Pole Und.. Enthayalum Lucifer Theater Polichadukkam...
2142	2142	Vysakh etta padam kandu  oru raksheyum illaa  powliii Ningal marnamassalla athukkum mele aan Waiting for #Minister Raja	positive	Vysakh etta padam kandu oru raksheyum illaa powliii Ningal marnamassalla athukkum mele aan Waiting for #Minister Raja
2143	2143	Annnnnnooii oru rakshem ella pwoliiiiiino words	positive	Annnnnooii oru rakshem ella pwoliiiiiiino words
2144	2144	Kidu energetic trailer     dislike adikkanum venam oru manakkatti	positive	Kidu energetic trailer dislike adikkanum venam oru manakkatti
2145	2145	Lucifer kanduu..... Thatikootuu padam....no story aake ulath kore vedivepum bombidilum..... Kashtmm thane.....	negative	Lucifer kanduu..... Thatikootuu padam....no story aake ulath kore vedivepum bombidilum..... Kashtmm thane.....
2146	2146	aaa dislike adicha poorimakkalude ammakku mohanlal anu adichu kodukkunnadu tonnunnu	negative	aaa dislike adicha poorimakkalude ammakku mohanlal anu adichu kodukkunnadu tonnunnu
2147	2147	Padam kndit vndum trailer kanumpo veror feel	positive	Padam kndit vndum trailer kanumpo veror feel
2148	2148	laletta na pole orale ullu malayalikalude ahagaramaya mohnlal	positive	laletta na pole orale ullu malayalikalude ahagaramaya mohanlal
2149	2149	Ithu pradheekshikuna ....pole avilla ...padam avarage ...	neutral	Ithu pradheekshikuna ....pole avilla ...padam average ...
2150	2150	Youtube enagne  hang akathirikkum .korach koodiya item alle vannikkn	positive	Youtube enagne hang akathirikkum .korach koodiya item alle vannikkn
2151	2151	Pulimurugan copy adi pole ind stund seen ellam	neutral	Pulimurugan copy adi pole ind stund seen ellam
2152	2152	Ee vishuvinu Madhura Rajayude oru Madhura കണി....  By a Lalettan Fan	positive	Ee vishuvinu Madhura Rajayude oru Madhura Kani.... By a Lalettan Fan
2153	2153	38000000 viewrs oh my goddddddddddddddddd  megastar the gr8	positive	38000000 viewers oh my god dddddddddddddddd megastar the gr8
2154	2154	Trailer pora..Oru pathu kollam mumbulla tamil cinemade trailer polund	negative	Trailer pora..Oru pathu kollam mumbulla tamil cinemade trailer polund
2155	2155	Oru 10 thavana kandu	positive	Oru 10 thavana kandu
2156	2156	Mammukka oru rakshayumilla. Mammukka mass ....	positive	Mammukka oru rakshayum illa. Mammukka mass ....
2157	2157	trailet ingana.appo cinema enganayundanne parayano... katta waiting..KL 40 fans	positive	trailer kangana.apple cinema enganayundanne parayano... katta waiting..KL 40 fans
2158	2158	Orumathiri tamil mass padam pole thonnunu...daivam noke parangu politiciansne oke ingane thalapathuvekkunne aavishamillatha hype alle ???.	neutral	Orumathiri tamil mass padam pole thonnunu...daivam noke parangu politiciansne oke ingane thalapathuvekkunne aavishamillatha hype alle ???.
2159	2159	Entee ponn ettaaa..... 1:50 ullayaa ah dialogue oru rekshayum illaaa.....  VAAA DA.....	positive	Entee ponn ettaaa..... 1:50 ullayaa ah dialogue oru rekshayum illaaa..... VAAA DA.....
2160	2160	Ipo allarkkum manasilayille lalunni charitra padam cheytal ingane undakum enn this is odiyan 2	negative	Ipo allarkkum manasilayille lalunni charitra padam cheytal ingane undakum enn this is odiyan 2
2161	2161	Padam kandu .....sidheeq ikka ....karayipikum alle ..ithoru sheelavakanda	positive	Padam kandu .....sidheeq ikka ....karayipikum alle ..ithoru sheelavakanda
2162	2162	Ikkaaaaa masss enn vechaal ithaam masss	positive	Ikkaaaaa masss enn vechaal ithaam massess
2163	2163	mohanlal anna ningal veru mass alla kola massaa	positive	mohanlal anna ningal veru mass alla kola massaa
2164	2164	Mohanlal. THE GREATEST OF ALL GREATES.	positive	Mohanlal. THE GREATEST OF ALL GREATEST.
2165	2165	Pooran mamooty	negative	Pooran Mammootty
2166	2166	entho missing aanu	neutral	entho missing aanu
2167	2167	Ellarum ikka ikkaa...Njan mathram anooo unni chettane mention cheyunnadh...Unni chettante pwoli	positive	Ellarum ikka ikka...Njan mathram anooo unni chettane mention cheyunnadh...Unni chettante pwoli
2168	2168	Lucifernne EzHuayallathu varakilla nnu urapaa pakshe padam pulimuragan level hittaa athu suraa	neutral	Lucifernne EzHuayallathu varakilla nnu urapaa pakshe padam pulimuragan level hittaa athu suraa
2169	2169	Raju etta ningal Malayala cinema ye Vere Level Aaakum Alle	positive	Raju etta ningal Malayalam cinema ye Vera Level Aakum Alle
2170	2170	Variety cinemayude rajav  mammooseeee ikkaaaaaaa	positive	Variety cinemayude rajav mammooseeee ikkaaaaaaa
2171	2171	Eee vishu ettan aganu konduvaa ennu parayan paranju!!!!!!	positive	Eee vishu ettan aganu konduvaa ennu parayan paranju!!!!!!
2172	2172	Entta ponnu laletta.... Parayan vakkukal illa  Mass ka bapp	positive	Ente ponnu lalettan.... Parayan vaakkukal illa Mass ka baap
2173	2173	Ithippo enthinulla purappadanavo randalum koodi Suraj  Soubi	positive	Ithippo enthinulla purappadanavo randalum koodi Suraj Soubi
2174	2174	Waiting from Qatar LalettaI'd tagarkum katta support heavy 48pravasyam trailer kandu wow	positive	Waiting from Qatar Laletta I'd tagarkum katta support heavy 48pravasyam trailer kandu wow
2175	2175	Ee item vech nammal nammade pracharanam thakarkkum..	positive	Ee item vech nammal nammade pracharanam thakarkkum..
2176	2176	enthe ponno enna lookkada mmmde eattan	positive	ente ponnu enna lookkada m de rattan
2177	2177	Ithu kidukkum Vere Levelu Aannu Makkaleee	positive	Ithu kidukkum Vere Levelu Aannu Makkaleee
2178	2178	Heavy mass        പൊളി	positive	Heavy mass collapse
2179	2179	Adutha flop	negative	Adutha flopped
2180	2180	Vere level ... Onnum parayan ella....	positive	Vere level ... Onnum parayan ella....
2181	2181	Mamooka ishtam. Ennitum Njan Lucifer kandu laletante acting Kidu anennu mammokka fan aya enik parayAthirikan pattilla..	positive	Mamooka ishtham. Ennitum Njan Lucifer kandu laletante acting Kidu annu mammootty fan aya enik parayAthirikan pattilla..
2182	2182	Oru nalla cinema kkaayi kathirikkkunnu.    Dhayavayi ithine 100 cr pattikayil kettaruth	neutral	Oru nalla cinema kkaayi kathirikkkunnu. Dhayavayi ithine 100 cr pattikayil kettaruth
2183	2183	Mass and class . Mammookka #faceofindiancinema . Nalla cinema aavatte	positive	Mass and class. Mammookka #faceofindiancinema . Nalla cinema aavatte
2184	2184	Rajuettan director ayath kond ith jaikkuvairikkum	positive	Rajuettan director ayath kond ith jaikkuvairikkum
2185	2185	Njan oru mohanlal fan aanu ennalum trailer istapettu pwoli	positive	Njan oru mohanlal fan aanu ennalum trailer istapettu pwoli
2186	2186	Ikka scene vere level	positive	Ikka scene vere level
2187	2187	Ithupole mooonchiya Oru padam jeevithathil kanditillaaa.....	negative	Ithupole mooonchiya Oru padam jeevithathil kanditillaaa.....
2188	2188	Trailer kannunathinu munne dislike adicha mahanmark adaranjalikal....ivrk matram engana pattunoo ijathi kuru pottikal....kashtam...	negative	Trailer kannunathinu munne dislike adicha mahanmark adaranjalikal....ivrk matram engana pattunoo ijathi kuru pottikal....kashtam...
2189	2189	Uff kidilam oru ethum pediyum kittanilla story nthayirikkumenn 5vare Kath irikkanamallo katta waiting	positive	Uff kidilam oru ethum pediyum kittanilla story nthayirikkumenn 5vare Kath irikkanamallo katta waiting
2190	2190	Etinum valiya surprise enni njngallu kittan ella	positive	Etinum valiya surprise enni njngallu kittan ella
2191	2191	LUCIFER KI JAY  LALLETTAN POLICHU MASS  VERUM  MASSALA  MARANA MASS LOVE  YOU LALLETTAAAAA	positive	LUCIFER KI JAY LALLETTAN POLICHU MASS VERUM MASSALA MARANA MASS LOVE YOU LALLETTAAAAA
2192	2192	Joy thakkolkaaranil ninnum oru massZz change	positive	Joy thakkolkaaranil ninnum oru massZz change
2193	2193	Njangada nattila shooting cheythe Prithviraj vere level	positive	Njangada nattila shooting cheythe Prithviraj vere level
2194	2194	Padam 100 cr kayariyathinu shesham kanunnavarundo	positive	Padam 100 cr kayariyathinu shesham kanunnavarundo
2195	2195	Myru Padam. Kaanendaayirunnu. Ookkaanam vannittu vayya.	negative	Myru Padam. Kaanendaayirunnu. Ookkaanam vannittu vayya.
2196	2196	Ikka kku nalla age feel cheyuunuu	neutral	Ikka kku nalla age feel cheyuunuu
2197	2197	anusithaaraye kaanan veendi trailer kandavar ivide like cheythooli	positive	anusithaaraye kaanan veendi trailer kandavar ivide like cheythooli
2198	2198	Kiduuu Trailer   Lalettan polichuu Apol ee onavum ettan kondupoi	positive	Kiduuu Trailer Lalettan polichuu Apol ee onavum ettan kondupoi
2199	2199	Njan A10 Fan ann but ikka pwolikkum katta waiting	positive	Njan A10 Fan ann but ikka pwolikkum katta waiting
2200	2200	Mammookkaaaa love uuuuu ingal poliyanuuuuuu 68 alla ingakk  34 aanuuuuuu	positive	Mammookkaaaa love uuuuu ingal poliyanuuuuuu 68 alla ingakk 34 aanuuuuuu
2201	2201	copy annan	negative	copy annan
2202	2202	Pandi rajaye malarthi adichu athanu lal magic	negative	Pandi rajaye malarthi adichu athanu lal magic
2203	2203	Poli poli poli .... am waiting..	positive	Poli poli poli .... am waiting..
2204	2204	Lalelattanum raju ettanaumulla oru film kure kalamayi aagrahichirunnu  athu nadannathilulla santhosham pinne parrayanundo🤩🤩🤩🤩🤩	positive	Lalelattanum raju ettanaumulla oru film kure kalamayi aagrahichirunnu athu nadannathilulla santhosham pinne parrayanundo🤩🤩🤩🤩🤩
2205	2205	Poliiiii oru rekshem illa katta waiting	positive	Poliiiii oru rekshem illa katta waiting
2206	2206	Dislike adicha oombanmaarude shraddhakku....  Kittiya collectionum kondu oodikko  Chekuthan ninte ettane eduthittu oookkunnund  Adyam avante kunna vayileduthu ethane rakshikk	negative	Dislike adicha oombanmaarude shraddhakku.... Kittiya collectionum kondu oodikko Chekuthan ninte ettane eduthittu oookkunnund Adyam avante kunna vayileduthu ethane rakshikk
2207	2207	369 dislike myrol ikka uyir haters myr	negative	369 dislike myrol ikka uyir haters myr
2208	2208	Telugu film pole masss  trailer	positive	Telugu film pole masses trailer
2209	2209	Hindu kalku mahiravan islaminu ebileesu christianikalkku LUCIFER	positive	Hindu kalku mahiravan islaminu ebileesu christianikalkku LUCIFER
2210	2210	Mohanlal fansinte full spprt ikka pwlichadukk .	positive	Mohanlal fansinte full spprt ikka pwlichadukk .
2211	2211	Maranamass item ente ponno  ijjathi	positive	Maranamass item ente ponno ijjathi
2212	2212	Happy birthday  ikka movie polkikum....	positive	Happy birthday ikka movie polkikum....
2213	2213	entay ponnoo kola kolli item vannu makkaleay	positive	entay ponnoo kola kolli item vannu makkaleay
2214	2214	mass aaan ikka ninga vere level aan	positive	mass aaan ikka ninga vere level aan
2215	2215	laletta movie kku super response aanalloo	positive	laletta movie kku super response aanalloo
2216	2216	Mass itom. Mass dialogue. Lalettan polikum	positive	Mass itom. Mass dialogue. Lalettan policum
2217	2217	Arokke endokke paranjalum ingal Mmale changan Dileepetta	positive	Arokke enthokke paranjalum ingal Male changan Dileepettan
2218	2218	Ee dislike adichavarde sredhayk enna kanditta enth mosam kanditta dislike adichathenn koode parayamo?	negative	Ee dislike adichavarde sredhayk enna kanditta enth mosam kanditta dislike adichathenn koode parayamo?
2219	2219	Pakaram vaikkan..ellatha prathibha....lal.... njan paranjathu sheriyalle...plse like	positive	Pakaram vaikan..ellatha prathibha....lal.... njan paranjathu sheriyalle...plse like
2220	2220	mohanlal ingnanu kure chavar pole irakkilla .vanalo...odukkathe varavaakum..luv u laletta	positive	mohanlal ingnanu kure chavar pole irakkilla .vanalo...odukkathe varavaakum..luv u laletta
2221	2221	Deslike adicha ella punnara makkalkum nanni	negative	Deslike adicha ella punnara makkalkum nanni
2222	2222	Poli padam njn ella mammooty movies kanarundu itrekku disapointed akkiya oru movie aduthundayittilla	negative	Poli padam njan ella mammootty movies kanarundu itharkku disappointed akkiya oru movie aduthundayittilla
2223	2223	Freezerinakathulla scene kandappo arkenkilum hollow man film orma varunnundo	neutral	Freezerinakathulla scene kandappo arkenkilum hollow man film orma varunnundo
2224	2224	Aah nalla best marakkar...sound kettal thanne ariyam...ithu adutha neeraliyo odiyano aavanulla laksham aanu...daivame ee pulli ithu enthinulla purapadu aanu...🤣	negative	Aah nalla best marakkar...sound kettal thanne ariyam...ithu adutha neeraliyo odiyano aavanulla laksham aanu...daivame ee pulli ithu enthinulla purapadu aanu...🤣
2225	2225	Muppathil kooduthal thavana kanda njanalle sherikkum mess	positive	Muppathil koodhuthal thavana kanda njanalle sherikum mess
2226	2226	avasanam kanjipole aavathirunal mathi all the best	neutral	avasanam kanjipole aavathirunal mathi all the best
2227	2227	Oru tamil movie touch pole. Expect to be a good movie	positive	Oru tamil movie touch pole. Expect to be a good movie
2228	2228	Pulimurugan pole akkan ulla udesham bt release kazhinj parayam kollavo elliyo enn	neutral	Pulimurugan pole akkan ulla udesham bt release kazhinj parayam kollavo elliyo enn
2229	2229	Polichu	positive	Polichu
2230	2230	Padam kanditt veendum trailer kaanan vannavar aarengilum undo enne pole	positive	Padam kanditt veendum trailer kaanan vannavar aarengilum undo enne pole
2231	2231	Ith kalki allaa ith kathi aahnu itiri	neutral	Ith kalki allaa ith kathi aahnu itiri
2232	2232	Swantham panavum padavum aauapol experimentation undavumo;)	neutral	Swantham panavum padavum aauapol experimentation undavumo ;)
2233	2233	Padam ettunila pottum ennu urappullavar like..	negative	Padam ettunila pottum ennu urappullavar like..
2234	2234	Ayyeeee....dialouge presentation ottum illa....evan enge nayakan ayi? Lalunni....evanano swayam complete actor ennu vilikanee.....myran	negative	Ayyeeee....dialouge presentation ottom illa....evan enge nayakan ayi? Lalunni....evanano swayam complete actor ennu vilikanee.....myran
2235	2235	mammookkaye ee traileril kandu njettattavar aarum undavilla !	positive	mammookkaye ee traileril kandu njettattavar aarum undavilla !
2236	2236	Oru thrilling und...  Padathilum ith muzhuneelam undakumennu karuthunnavar...  Like here	positive	Oru thrilling und... Padathilum ith muzhuneelam undakumennu karuthunnavar... Like here
2237	2237	Aayea.... ithu oru unda aavolo.... boar ....	negative	Aayea.... ithu oru unda aavolo.... boar ....
2238	2238	enth moonjiya padam oombiya kadha parachil avante konathile padam	negative	enth moonjiya padam oombiya kadha parachil avante konathile padam
2239	2239	Haneef adeni  Ninakevdunna mone ijjathi kolakolly items kitenne Vere level	positive	Haneef adeni Ninakevdunna mone ijjathi kolakolly items kitenne Vere level
2240	2240	No words to say katta pwoli van mass	positive	No words to say katta pwoli van mass
2241	2241	Petrol vila karanam raja cycilil. polichu!!!!!	positive	Petrol vila karanam raja cycilil. polichu!!!!!
2242	2242	Pala chettakalum chelakkatte ith onnonnara padaman	positive	Pala chettakalum chelakkatte ith onnonnara padaman
2243	2243	Licifer vannna ennenthe pooram vanu.....madhuraraja 6 manik thanne poyi......but l is loading...coming....minutes left	positive	Lucifer vannu ennenthe pooram vannu.....madhuraraja 6 manik thanne poyi......but l is loading...coming....minutes left
2244	2244	theateril elaarkum moonjiya expression aannallo kandu kazhinju	negative	theateril elaarkum moonjiya expression aannallo kandu kazhinju
2245	2245	E oru trailarinu vendiyanu njan kathirunnathu powliyanu... Kiduvanu... katta massanu....	positive	E oru trailarinu vendiyanu njan kathirunnathu powliyanu... Kiduvanu... katta massanu....
2246	2246	Malayala cinema yude thalavara maattum e padam	positive	Malayala cinema yude thalavara maattum e padam
2247	2247	eth 14k alavalathikal aanu dislike adichath	negative	eth 14k alavalathikal aanu dislike adichath
2248	2248	Kidu trailer oru rakshem illa katta waiting	positive	Kidu trailer oru rakshem illa katta waiting
2249	2249	KGF kanda oru effect trailer kandapol kitty	positive	KGF kanda oru effect trailer kandapol kitty
2250	2250	Katta waiting aliyoo njanga malayalikalkkum nddaa mass padangal	positive	Katta waiting aliyoo njanga malayalikalkkum nddaa mass padangal
2251	2251	Surajettan ippol kadhapathramayi jeevikkukayanu.. mikka cinemakalilum	positive	Surajettan ippol kadhapathramayi jeevikkukayanu.. mikka cinemakalilum
2252	2252	Polichittund Lal ettan fans like adi	positive	Polichittund Lal ettan fans like adi
2253	2253	pwolikkum #Unni #mammukka oru valya vijayam aakatte	positive	pwolikkum #Unni #mammukka oru valya vijayam aakatte
2254	2254	Kolakolli Item Ikka war mode on	positive	Kolakolli Item Ikka war mode on
2255	2255	ട്രൈലെർ കിടു  Wishes to Janapriya Nayakan Dileepettan from Lalettan Fans	positive	Trailer Download Wishes to Janapriya Nayakan Dileepettan from Lalettan Fans
2256	2256	onnil kooduthal thavana trailer kandavar pls like here	positive	onnil koodhuthal thavana trailer kandavar pls like here
2257	2257	uff trailer  mamuka mohanlal legends aanu oru tharkavum venda	positive	uff trailer mamuka mohanlal legends aanu oru tharkavum venda
2258	2258	HAPPY BIRTHDAY IKKKAAAAAAA  LOVE YOU IKKKAAAAAAAAA	positive	HAPPY BIRTHDAY IKKKAAAAAAA LOVE YOU IKKKAAAAAAAAA
2259	2259	massakkan  3.14 m venda 1.46 mathi love you raja	positive	massakkan 3.14 m venda 1.46 mathi love you raja
2260	2260	Jai marikkunnath kandappol othiri sangadamaayi	negative	Jai marikkunnath kandappol othiri sangadamaayi
2261	2261	Njan Ettan fana ennaalum paraya e padam polikkum	positive	Njan Ettan fana ennaalum paraya e padam polikkum
2262	2262	Lalettanu Thulayam malayalam film industry yil Latten mathram...	positive	Lalettanu Thulayam malayalam film industry yil Latten mathram...
2263	2263	cinema kandu....addipoli.. adyamaayitta oru cinema adhe divasam 2 thavana theatril kaanunne	positive	cinema kandu....addipoli.. adyamaayitta oru cinema adhe divasam 2 thavana theatril kaanunne
2264	2264	Adipoli Trailer.......   parayaan Vaaakkilaa  Lalettan fans like here	positive	Adipoli Trailer....... parayaan Vaaakkilaa Lalettan fans like here
2265	2265	kure naalu koodiya oru mammookka trailer kaandu santhosham thonunnathu.	positive	kure naalu koodiya oru mammookka trailer kaandu santhosham thonunnathu.
2266	2266	Kutam parayunavaru Maryadaku zha parayan ariyatha team anu	negative	Kutam parayunavaru Maryadaku zha parayan ariyatha team anu
2267	2267	Jayettan + Thrissur Oru Ugran PooraM Kodiyeri makkale...  katta waitin	positive	Jayettan + Thrissur Oru Ugran PooraM Kodiyeri makkale... katta waitin
2268	2268	Ho aaa BGM. Mammookka ithu oru pwoli pwolikkum	positive	Ho aaa BGM. Mammookka ithu oru pwoli pwolikkum
2269	2269	Ithu oru onnonnara item anu makane ee........Mass alla athukkum meleee.....	positive	Ithu oru onnonnara item anu makane ee........Mass alla athukkum meleee.....
2270	2270	Sirea ethu keari koluthunna lekshanam undallo... bumbar hitavattea	positive	Sirea ethu keari koluthunna lekshanam undallo... bumbar hitavattea
2271	2271	Venda kutta uruttam last dialogue polii....	positive	Venda kutta uruttam last dialogue polii....
2272	2272	Pavam sanjeev pillaiku enthengilum credit kodukeda nayinte makkale	negative	Pavam sanjeev pillai enthenkilum credit kodukeda nayinte makkale
2273	2273	Ente mammookka  Ithokke abhinayikkanel minimum range venameda  Vere level	positive	Ente mammookka Ithokke abhinayikkanel minimum range venameda Vere level
2274	2274	TRAILER VERE LEVEL ... ITH PWLIKKM	positive	TRAILER VERE LEVEL ... ITH PWLIKKM
2275	2275	After Neram	neutral	After Neram
2276	2276	Nice ... Varampo kaanam engana nu ....	positive	Nice ... Varampo kaanam engana nu ....
2277	2277	Pazhanjan formula aanaloo .....  Oru gramam	neutral	Pazhanjan formula aanaloo ..... Oru gramam
2278	2278	cia   bgm  tch   undalllo  copy  etttaa	negative	cia bgm tch undalllo copy etttaa
2279	2279	Ethreyum nalla oru creativity ku dislike cheyunnavarodu oru load pucham	negative	Ethreyum nalla oru creativity ku dislike cheyunnavarodu oru load pucham
2280	2280	waiting  ganagandharvan mamankom sherlock bilal  enik vayya.... mass ka baapp	positive	waiting ganagandharvan mamankom sherlock bilal enik vayya.... mass ka baapp
2281	2281	Mammootty enna name thanne mathi charithra cinimakal poyi kaanan	positive	Mammootty enna name thanne mathi charithra cinimakal poyi kaanan
2282	2282	30 minute 34 k views padam poorikum	positive	30 minutes 34 k views padam poorikum
2283	2283	mohanlal fananu but e filim ethraku pokanonnum ella. raju ethilentha amanushikano?	neutral	mohanlal fananu but e filim ethraku pokanonnum ella. raju yelentha amanushikano?
2284	2284	Ith pole films aanu tamil telungu mass movies aakunnath	positive	Ithu pole films aanu tamil telugu mass movies akunnath
2285	2285	Camera style kandappo chapa kurush ormavannu	neutral	Camera style kandappo chapa kurush ormavannu
2286	2286	Heavy..Mass & Clas...cudos team Lucifer... Laalettaa ingalu Muthaanu...Double Role Aanu Makkale......	positive	Heavy..Mass & Clas...cudos team Lucifer... Laalettaa ingalu Muthaanu...Double Role Aanu Makkale......
2287	2287	Ottavakkil paranjal oru Pavam Padam.... But powerful	positive	Ottavakkil paranjal oru Pavam Padam.... But powerful
2288	2288	Ethra vattam kandu ennu areela	positive	Ethra vattam kandu ennu areela
2289	2289	Verum mass alla kola mass raja daa	positive	Verum mass alla kola mass raja daa
2290	2290	Kandit romanjam vernnu ikka eth ningale konde sadikku	positive	Kandit romanjam vernnu ikka eth ningale konde sadikku
