	Unnamed: 0	Unnamed: 0.1	sentence	sentiment	transliteration	translation
1418	1418	1418	Ithaanu njangalkk vendath...ippo oru pakka mass entertainer anivaryam... Realistic oke kandu kandu maduthu....marana waiting for kalkki	positive	ഈതാനു ന്ജംഗാലക്ക വേന്ദഥീപ്പോ ഓരു പക്കാ മാസ ആന്റര്ത്നര് അനീവാര്യമ രിയാലിസ്റ്റിക് ഓകേ കാണ്ഡു കാണ്ഡു മദുതുമാരനാ വൈറ്റിങ് ഫര കല്ക്കീ	Ethan Njangalaka Vendathipo one Paka month Anderthner Inevitability Realistic okay Kandu Kandu Maduthumarana Whiting Fara Kalki
1419	1419	1419	Triler kollam... but anu sithara.... kolamakum... seriel dialogu pole parayunnund anu sithara	neutral	ത്രിലര് കൊല്ലം ബുത അനു സീഥാരാ കോലാമകുമ സേരീല് ദീഅലോഗു പോല പരയുംന്നുംദ അനു സീഥാരാ	Thriller Kollam Wednesday Anu Sithara Kolamakuma Seril The dialogue like Parayumnundha Anu Sithara
1420	1420	1420	Fight scene marana maasss repeat  adich kanuva	positive	ഫൈറ്റ് സീന മാരാനാ മാസ്സ റേപേട  ആദിച കനുവാ	Fight Seena Marana Massa Don&#39;t worry Adicha Canua
1421	1421	1421	Thakarthutto...  Onnalla orupaadu kaaranangalaa...  ith thakarkkum...	positive	ഠാകരതുട്ടോ  ഓംനല്ലാ ഓരുപാദു കാരനംഗലാ  ഇത ഠാകരക്കമ	Thakaratuto Not Om Orupadu Caranangala This Thakarakama
1422	1422	1422	ikkante eazhrikath varilla ikkante varunnu kunjali marakkar  WAITING IKKA POLIKKUM	negative	ഇക്കാന്ത് ഈഅഝ്ഹ്രീകത വാരില്ലാ ഇക്കാന്ത് വരുന്നു കുംജലി മാരക്കാര  വൈറ്റിങ് ഇക്കാ പോലിക്കുംമ	Ikanth Eajhreikata Warilla Ikanth is coming Kumjali Marakara Whiting Ika Pollykumma
1423	1423	1423	Lalettaaa sahikkunnillaa waiting for you.... Stephen.....	positive	ലാലെട്ടാ സഹീക്കുന്നീല്ലാ വൈറ്റിങ് ഫര യൂ സ്റ്റെഫേന	Laletta Can&#39;t stand it Whiting Fara Yu Stephena
1424	1424	1424	Pinnne Bgm adipoli ikkayude nadatham koodi aavumbo parayandallo	positive	പിന്നേ ബ്ഗ്മ ആദിപോലി ഇക്കായുഡേ നദതമ കൂഡി ആവുമ്ബോ പരായണന്കല്ലോ	Then Bgma Adipoli Ikayude Nadathama too maybe Read it
1425	1425	1425	Oru rekshayum illaa padam polichuuuu mass marana mass parayan vakkukal illaaaaaaaaa	positive	ഓരു രേക്ഷയുംമ ഇല്ലാ പദമ പോളിചൂ മാസ മാരാനാ മാസ പരായണ വക്കുകല ഇല്ലാ	one Reksha too no Padma Polychoo month Marana month Recitation Art no
1426	1426	1426	innale 7 Mani muthal Kath Kath ninnu trailer nu vendi.....thakarppan trailer .... love you mammukkaaaaaa	positive	ഇന്നാലേ 7 മണി മുഥല കഥ കഥ നീന്നും ട്രേല്ര് നൂ വേംദീഥാകരപ്പന ട്രേല്ര്  ലവ യൂ മമ്മുക്കാ	Only today 7 bell Muthala story story will swim The trailer Nu Vemdithakarapana The trailer Love Yu Momma
1427	1427	1427	Njagade lalettanum manju  chechiyum kolamass jodi annu.	positive	ന്ജഗഡ ലാലെത്താനുംമ മംജൂ  ചേചിയുംമ കോലാമസ ജോഡീ അന്നു	Njagada Lalethan too Manju Sister Kolamasa pair that day
1428	1428	1428	enthu oola trailer aanu ithu. poor dialogue delivery	negative	ഏനതും ഊലാ ട്രേല്ര് ആനു ഇതു പൂര ദീഅലോഗു ഡെലിവറി	Anything Oola The trailer Anu This Pura The dialogue Delivery
1429	1429	1429	Oru pandi comedy pandum pole unnd	neutral	ഓരു പണ്ഡി കോമേഡി പാണ്ഡുമ പോല ഉന്ന്ദ	one Pandi Comedy Panduma like happy
1430	1430	1430	Kalki Kalakki Achayane innu Mannarkadinnu kande ollu...appo ithreyum pradheeshichilla	positive	കല്കീ കലാക്കീ അചയാനേ ഇന്നും മന്നര്കാദീന്നു കംഡേ ഓല്ല്വാപ്പോ ഇത്രേയുംമ പ്രധിശീചില്ലാ	Kalki Kalakee Achayan Even today Mannarcadin Come on Ollwapo That&#39;s all There is no region
1431	1431	1431	Yessss the Lion returnzzzzz...kattaa waitingggg ikkkaaaaa	positive	യെസ്സ ദ ല്യോന് രേതുര്ന്ബകത്താ വൈറ്റിങ്ഗ ഇക്കാ	Yessa The Lyon In retrospect Whitinga Ika
1432	1432	1432	Hollywood level mass ithanu makkale trailer	positive	ഹോളിവുഡ് ലെവല് മാസ ഇതാനും മക്കാലേ ട്രേല്ര്	Hollywood level month And this too Macaulay The trailer
1433	1433	1433	Mass entertainment... oru rekshayum illa... pwoli...	positive	മാസ ആന്റര്ത്ന്മെന്റ് ഓരു രേക്ഷയുംമ ഇല്ലാ പ്വോലി	month Entertainment one Reksha too no Powley
1434	1434	1434	ikkaaaaa     jeevannn	positive	ഇക്കാ     ജീവനന	Ika food
1435	1435	1435	Pazhashirajayude aduttonnum itu varilla.itu bahubalida copiyadi	neutral	പഝ്ഹാശീരാജയുദേ അദുത്താന്നമ ഇതു വാരില്ലൈതു ബാഹുബലിദാ കോപിയാദി	Pajhashirajayude Aduthannama This Warillaitu Bahubali copycat
1436	1436	1436	Thelunku nadan ..bhaala krishnayeyum... Thal nadan vijaya kaandhineyum ..naanipichu...mammuunny...	negative	തേലുംന്കു നദന ഭാലാ കൃഷ്ണയേയുംമ ഥല നദന വിജയാ കാന്ധീനേയുംമ നാനിപിചുമമ്മഊന്ന്യ	For oil Nadana Bhala Krishna Thala Nadana Vijaya And Kandhi Nanipichumammaoonnya
1437	1437	1437	Swondham appane kandal adikunnavanmara ithinoke dislike adikunne. Adichondu avide irikathe ullu. Ivide ettanm pillerum stronga dbl strong	negative	സ്വോനധാമ അപ്പനേ കന്ദല് ആദികുന്നവന്മാരാ ഇതീനോക ഡിസ്ലീകേ ആദികുന്ന ആദിക്കോംദു അവിഡ് ഈരീകാതേ ഉല്ലു ഇവിഡ് ഏത്തന്മ പിലഇരുമ സ്ട്രോംഗാ ഡ്ബ്ല സ്ട്രോംഗ്	Svanadhama father Kandal O pioneers Look at this Dislike Adicunna Adi Komdu Avid Ereekate Chili Evid whatever Pilairuma Stronga Dw Strong
1438	1438	1438	Njn epo 100 vattam kandu ningalo?	positive	നജന എപോ 100 വത്തമ കാണ്ഡു നീന്കലോ	Najana when 100 the best Kandu Can you swim?
1439	1439	1439	Njanum oru ikka fan ann  Pashe sambavam polichu	positive	ന്ജനുംമ ഓരു ഇക്കാ ഫന അന്ന  പശേ സമ്ബവമ പോളിചു	Njanumma one Ika Fana Anna cow The incident Polichu
1440	1440	1440	Look kandappol surajettan serios anenna thoniyath angeru polya pand behalam vechu comedy kanikkum ippo silentay kanikkum	positive	ലൂക കന്ദാപ്പോല് സുരജേത്തന സേരിയ അനേന്നാ തോനീയത അന്ഗേരു പോല്യാ പാന്റ് ബേഹാലം വേചു കോമേഡി കനിക്കുംമ ഇപ്പോ സിലേന്ട്യ കനിക്കുംമ	Luke As in Kanda Surajetna Seria That&#39;s it Tolerability Angeru Polya pant Behalem cooked Comedy Kanikumma now Silence Kanikumma
1441	1441	1441	Trail luciferinte athra illelum.... Padam heavy aaayirikum.....	neutral	ട്രില് ലുസിഫേരിന്റ അത്രാ ഇല്ലേലമ പദമ ഹേവ്യ ആയിരികുമ	Trill Lucifer&#39;s That&#39;s it Illelama Padma Hevya will be
1442	1442	1442	E polippan trailerinokke dislike adichathu ethu keedangallannavo... kuru pottal ippazhe thundangi....	negative	ഏ പോലിപ്പന ട്രേല്രിനോക്കേ ഡിസ്ലീകേ ആദിചാതും ഏതു കിദാംഗല്ന്നാവോ കുരൂ പോട്ടല ഇപ്പഝ്ഹേ ഥുന്ദാനഗീ	A Polypana Look at the trailer Dislike Adichat too Which Kidangalnnao Come on potala Ipajhahe Thundanagee
1443	1443	1443	192K Views	positive	192ക വിഏവ്സ	192k Vevsa
1444	1444	1444	Ufff  ejjathi nte ponn ikka. MAMMOOKKA UYIR	positive	ഉഫ്ഫ  ഏജ്ജാഥീ നീം പോനന ഇക്കാ മമൂക്കാ ഉയീര	Phew Ejjathi Neem Ponana Ika Momoka tall
1445	1445	1445	Model School 🤩🤩🤩 Romanjam  Trivandrum	positive	മോദേല് സ്കൂല്  റോമംജമ  ത്രീവാന്ദ്രമ	model School Romamjama Trivandrum
1446	1446	1446	Raja varunnu Maniyayi.  Rajamani	positive	രാജാ വരുന്നു മാനിയായീ  രാജമനീ	the king is coming Dear Rajamanee
1447	1447	1447	Oru pucca classical ikka padam...vadakka veergatha orma vannu.  ...	positive	ഓരു പുക്കാ ക്ലാസ്സിക്കല് ഇക്കാ പദംവാദക്കാ വിര്ഗതാ ഓര്മാ വനനു  	one smoke Classically Ika Padamvadaka Virgata remember to the forest
1448	1448	1448	Viswasichu koode nilkkunnavare jeevan koduthum samrakshikkum..  ikkayude voice & dialogue uff orujathi odukkathe feel.. romanjam at peak	positive	വിശ്വസീചു കൂഡേ നീലക്കുംന്നവരേ ജീവന കോദുതുമ സമ്രാക്ശീക്കുംമ  ഇക്കായുഡേ വോഈസ  ദീഅലോഗു ഉഫ്ഫ ഓരുജാതി ഓടുക്കതേ ഫീല റോമംജമ ആട പേക	Believable Also Blue ones Jeevan Koduthuma Samrakshikumma Ikayude Voice The dialogue Phew Oru caste Just run Phila Romamjama dress Bear
1449	1449	1449	Coppy ful Best actor polinhju kuthupala Edukkum	negative	കോപ്പി ഫൂല ബെസ്റ്റ് അക്ടര് പോളിന്ഹ്ജു കുതുപാല ഏടുക്കുമ	Copy Phula Best actor Polinhju Kutupala will take
1450	1450	1450	Fight scenes muzhuvan hvy  aayittind	positive	ഫൈറ്റ് സീന മുഝ്ഹുവന ഹ്വ്യ  ആയിത്തിംദ	Fight Seena Mujhuwana Hvya Aayithimda
1451	1451	1451	Ichyaaaa polich nanum indu ee moviel kalki 🤩	positive	ഇച്യാ പോലീച നനുംമ ഇംദു ഈം മോവീഏല കല്കീ 	dear the police Nice Imdu Ahem Not a movie Kalki
1452	1452	1452	Trailer mass marana mass... Ini screen il... Padam kanan njnm undkum	positive	ട്രേല്ര് മാസ മാരാനാ മാസ ഇനീ സ്ക്രീന് ഇല പദമ കാനന ന്ജ്ന്മ ഉണ്ഡ്കുമ	The trailer month Marana month You screen leaf Padma Canon Njnma Undukuma
1453	1453	1453	Trailer ennokke paranjal ithanu... ejjatji item	positive	ട്രേല്ര് എന്നോക്കേ പരംജല ഇതാനും ഏജ്ജാത്ജീ ഇതേമ	The trailer I&#39;m sorry Paramjala And this too Ejjatji The same
1454	1454	1454	1989 il vadakkan veeragadha theateril kanda nhan veendum oru epic cinema kaanan thayyaredukkunnu.. MT yude dialogukalkk pakaram vekkan onnumilla..	neutral	1989 ഇല വാദക്കന വിരഗധ തിയേതേരില കംദ ന്ഹാന വേംദുമ ഓരു എപിക് സിനേമാം കാനന തയ്യാരേടുംക്കുന്നു മ്ട യുഡേ ദീഅലോഗുകാലക്ക പകാരമ വേക്കന ഓന്നുംമില്ലാ	1989 leaf Argument Disgusting There is no theater Kamda Nhana Venduma one Epic cinema Canon Getting ready Mr Uday Dialogukalaka Pakarama Wake up Not even on
1455	1455	1455	Dado Girija	neutral	ദാദോ ഗിരിജാ	Dado Girija
1456	1456	1456	Itu pwolikum..laletta..iru rakshayum illa trailel..pakka professionalism..ente Oru prarthana..ippravisham manju chechide mass dialogue onnum ondkalle..kanji edukutee pole..	neutral	ഇതു പ്വോലികുമ്ലാലെട്ടൈരു രക്ഷയുംമ ഇല്ലാ ട്രേലേല്പക്കാ പ്രൊഫെസ്ഷനാലീസ്മേന്റ് ഓരു പ്രാര്ഥനാഥപ്പ്രവീഷമ മംജൂ ചെചിഡ് മാസ ദീഅലോഗു ഓനനുംമ ഓംഡ്കാല്ലേകാന്ജീ ഏദുകുതി പോല	This Pvolikumlalletairu Salvation no For the trail Professionalism one Prathanathpraveeshama Manju Chechid month The dialogue Onanumma Omdkallekanjee Eighth tax like
1457	1457	1457	Appo 21 kanum   Uff poli item	positive	അപ്പോ 21 കനുംമ   ഉഫ്ഫ പോളി ഇതേമ	So 21 Kanumma Phew Polly The same
1458	1458	1458	Unda enna perittappo parihasicha priyadarshanu kod urundaa	negative	ഉണ്ഡാ ഏനനാ പെരിത്താപ്പോ പരിഹാസീചാ പ്രിയദര്ശാനു കോട ഉറുന്ദാ	Unda Enana Perithapo Ridiculous Dear Darshan Koda Urunda
1459	1459	1459	God marichu ene paranjit ole part karinje oru k.g.f feel thonni	neutral	ഗോഡ മാരിച്ചു ഇന പരണജീത ഓലേ പാര്ട്ട് കരീന്ജ് ഓരു ക്ഷ ഫീല ഥോനനീ	Goda killed Ina Paranjita Olay Part Karinj one Ksha Phila Thonanee
1460	1460	1460	Thoopil Joppan poley ulla oru Item aavand irunnal mathi aarunnu🥺🥺🥺.	neutral	ഥഊപില ജോപ്പന പോലേ ഉല്ലാ ഓരു ഇതേമ ആവന്ദ ഈരുന്നല മഥീ ആരുന്നു	Thaoopila Joppana like Ullah one The same Avanda Erunnala Matthew who
1461	1461	1461	oru charithra cinimakku venda 3 kariyangal illa	negative	ഓരു ചരീഥ്രാ സിനീമക്കും വേന്ദ് 3 കരീയാംഗല ഇല്ലാ	one Character And for movies Wend 3 charcoal no
1462	1462	1462	Maoist alla Maoistnte apanae varee  nammal  putikum all the best mammoka  & unda movie team	positive	മാറ്റിസ്റ്റ് അല്ലാ മാറ്റിസന്റ് അപനേ വരീ  നമ്മല  പുതികുമ എല്ല ദ ബെസ്റ്റ് മമ്മോകാ   ഉണ്ഡാ മോവീഏ ടെമ	Matist no Mattisant Apane row We are New girl Ella The Best Mammoka Unda The movie Tema
1463	1463	1463	id thakarkum  kure idavelak shesham  mammooka vs lalettan (mammoka fan)	positive	ഇദ ഠാകര്കുമ  കുരേ ഇദവേലക ശേഷമ  മമൂകാ വ ലാലെത്തന മമ്മോകാ ഫന	Ida Thakarkuma Kure Idavelaka After Momoka W Lalethana Mammoka Fana
1464	1464	1464	Pooram kaanathe dislike adichavarkk  #naduviral pranaamam	negative	പൂരമ കാനാഥ ഡിസ്ലീകേ ആദിചാവര്ക്ക  നാദുവീരസ് പ്രണാമാമ	Purama Kanatha Dislike Adichavarka Naduvirus Pranamama
1465	1465	1465	Mammookka fight ohh romam ezhunetu nililkkum	positive	മമൂക്കാ ഫൈറ്റ് ഓംഹ രോമമ ഈഝ്ഹുനേതു നീലിലക്കുംമ	Momoka Fight Omha fur To Ejhhu Neelikakumma
1466	1466	1466	Katta waitingRaju eattan tovino  lallettan	positive	കട്ടാ വൈറ്റിംഗ്രാജു ഈത്തന ടോവിനോ  ലാലെട്തന	Kata Whitingraju Ethana Tovino Lalethana
1467	1467	1467	machaa.......aa BGM ente manasill angottu keri polipolikukayaanu	positive	മഛാ ബ്ഗ്മ ആന്റ് മാനാസില്ല അംഗോത്തു കേരി പോളിപോലികുകയാനു	Father Bgma Ant There is no mind Agreed Kerry Polipolikukayanu
1468	1468	1468	Aarada dislike adikkane ethil entha kuzhappam	negative	ആരദ ഡിസ്ലീകേ ആദിക്കാനേ എതീല ഏന്ഥാ കുഝ്ഹാപ്പമ	worship Dislike Adikan Ethela what Kujhhapama
1469	1469	1469	ഇവാൻ  spycho aaadaaa    Ente epono ijathi	positive	ഇവൻ  സ്പൈചോ ആദാ    ആന്റ് എപോനോ ഇജാഥീ	This one Spycho E.g Ant Epono Ijathi
1470	1470	1470	Abhinayathinde manarisam thiricharinja mahanadana vaibhsvam mohanlal enna MALAYALIYUDE oru sokharya sambhavamanu ennum eppozhum All friends congratulation	positive	അഭിനയതീനഡേ മാനരീസമ ഥീരീചരീന്ജാ മഹാനാദനാ വൈഭ്സ്വമ മോഹനലാല ഏനനാ മലയലീയുഡേ ഓരു സോഖര്യാ സമഭാവമനു എന്നമ എപ്പോഝ്ഹുമ എല്ല ഫ്രീഏംദ കോംഗ്രതുലറ്റേഷന്	Acting Mannersama Theericharinja Mahanadana Vaibhswama Mohanalala Enana Malayaleeday one Sokharya For equality Name Epoch Huma Ella FreeEmda Congratulations
1471	1471	1471	Ith polikkum kanditt oru atom bombin vakayundd	negative	ഇത പോലിക്കുംമ കന്ദിത്ത ഓരു ആറ്റം ബോംബീന വകയുംദ്ദ	This Pollykumma Kandita one the atom Bombina Wakayumda
1472	1472	1472	Ethe pulimuruganta music aanallo full enthayalum mamookka polichu	neutral	എഥ പുലിമുരുഗംതാ മ്യൂസിക് ആനാല്ലോ ഫുഅല എന്തയാലുമ മമൂക്കാ പോളിചു	Etha Tiger Music Because Fuala whatever Momoka Polichu
1473	1473	1473	njan mammukka fan aan yennalum parayaa lalettan mathrame ithokke kazhiyu adheham oru loka nayakanan oru simham	positive	ന്ജന മമ്മുക്കാ ഫന ആന യെന്നാലുംമ പരയാ ലാലെത്തന മാഥ്രമ ഇഥോക്കേ കാഝ്ഹീയും അധേഹമ ഓരു ലോകാ നായകാനന ഓരു സിമഹമ	Njana Momma Fana elephant Even though Paraya Lalethana only Ithokay and Kajhi Adhemah one Loka Nayakanana one Simaha
1474	1474	1474	Lalettan ishttam.. Rajuettan ishttam!! Murali Gopi's script	positive	ലാലെത്തന ഇശ്ട്തമ രാജുത്തന ഇശ്ട്തമ മുരലീ ഗോപീസ സ്ക്രീപ്ത	Lalethana Ishtama Rajuthana Ishtama Murali Gopisah Script
1475	1475	1475	Nerathe irakkiya bomb kadha tanne..  atleast nedumudi venu te dialogue enkilum mati pidikamayirunnu....	neutral	നേരത ഇറാക്കീയാ ബോംബ് കാധാ തന്നേ  അത്ലീസ്റ്റ് നേദുമുദീ വേണു തേ ദീഅലോഗു എന്കീലുമ മാറ്റി പിദീകമഈരുനനു	straight away Iraqi the bomb Kadha Yes Athlete Nedumudi want the The dialogue Enkieluma Changed Pidikamairunan
1476	1476	1476	Character eakadesham same Aaanallo Vyshakh sir	neutral	ചരാക്ട്ര് ഈകദേശാമ സമേ ആനാല്ലോ വ്യ്ശാഖ സീര	Character Ekadesama same Because Vyshaka Zeera
1477	1477	1477	Addddiiiiipolliiiii.....marana masss.....oru sakshem illa....lalettande kidu look.....🤩🤩	positive	അദ്ദൈപ്പോല്ലീമരാനാ മസ്സോരു സക്ഷേമ ഇല്ലാലലേട്ടാണ്ഡേ കിഡു ലൂക	Addaipolymerana Massouru welfare Illalale Kidu Luke
1478	1478	1478	Oh...Iththakathallo. sankar ramakrishnanu dhairyamayi kunjalimarakkar directcheyyam	positive	ഓഹീത്തകഥാല്ലോ സംകര രാമകൃഷ്നാനും ധൈര്യമയീ കുംജലീമാംരക്കാര ദിരേക്ത്ചിയമ	It&#39;s a fairy tale Sankara And Ramakrishnan Be brave Kumjalimamrakara Direction
1479	1479	1479	( ( ( KIDILOSKI   ) ) ) )	positive	   കിദിലോസ്കീ      	Kidiloski
1480	1480	1480	Puchivhavarkulla marupadi athum triple strongill ikka ishtam	positive	പുചിവ്ഹാവര്കുലആ മാരുപദീ അതുമ ത്രിപ്ല് സ്ട്രോണ്ഗീല് ഇക്കാ ഇശ്തമ	Puchivhavarkulaa Marupadi That&#39;s it triple Strongiel Ika Ishtama
1481	1481	1481	Linto kurian fans  jayasurya nte career le super trailer	positive	ലീംടോ കുരിയന ഫംസ  ജയസുര്യ നീം കാരീര ലേ സൂപ്പര് ട്രേല്ര്	Leamto Kuriana Phamsa Jayasurya Neem Karira Lay Super The trailer
1482	1482	1482	Fanism baadhicha Kore malaranmaar dislike adikkunnu...	negative	ഫണിസമ ബാധിചാ കോരേ മാലാരന്മാര ഡിസ്ലീകേ ആദിക്കുന്നു	Funisma affected Corey Malarans Dislike is beginning
1483	1483	1483	Raajayum pillerum triple strong ennu teaseril. Prithvirajinte oru cameo manakkunnu.	positive	രാജയഉംമ പിലഇരുമ ത്രിപ്ല് സ്ട്രോംഗ് എന്നു ടീസ്രില പ്രീഥ്വീരാജീന്റ ഓരു കാമിയോ മാനക്കുന്നു	Rajayaumma Pilairuma triple Strong that No teasers Prithvirajeena one Cameo respect
1484	1484	1484	Ikkante voice kelkumbo thanne romanjam.. bakki pinne parayannoo.... Ikka ningal vere level annu	positive	ഇക്കാന്ത് വോഈസ കേല്കുംബോ ഠാന്നേ റോമംജമ ബക്കീ പിന്നേ പരായന്നൂ ഇക്കാ നീന്ഗല വേരാ ലെവല് അന്നു	Ikanth Voice Kelkumbo Thane Romamjama Bucky Then Read on Ika Ningala Vera level that day
1485	1485	1485	Kidukkachi  Ingane venam mass kaanikkaan allathe alari vilichaal mass aavilla	positive	കിദുക്കാചീ  ഇന്ഗണേ വേണാമ മാസ കാനിക്കാന അല്ലത അലാരീ വിലിചാല മാസ ആവില്ലാ	Kidukachee so don&#39;t want month Canicana not Alaree Vilichala month can&#39;t
1486	1486	1486	bgm kollam greater father ila villianila poola	positive	ബ്ഗ്മ കൊല്ലം ഗ്രേറ്റര് ഫാഥര് ഇലാ വില്ലിയനീലാ പൂലാ	Bgma Kollam Greater Father Ila Willian Blue Pula
1487	1487	1487	Ikka ingalu polichu vere level	positive	ഇക്കാ ഇന്ഗാലു പോളിചു വേരാ ലെവല്	Ika Ingalu Polichu Vera level
1488	1488	1488	Aa traileril Nakul Thampiye shradhichath njn maathram aano ???  Mammookka ingal muthaan.Kann edukaane pattunnillaa.... #Mammukka ishttam	positive	ആ ട്രേല്രില നാകുല ഥാമ്പിയേ ശ്രധീചാത നജന മാഥ്രാമ ആനോ   മമൂക്കാ ഇന്ഗല മുഥാന്കന്ന ഏദുകാനേ പത്തുന്നീല്ലാ മമ്മുക്കാ ഇശ്ട്തമ	That No trail Nakula Thampi attention Najana Mathrama Ano Momoka Engala Muthankanna Edukane Not ten days Momma Ishtama
1489	1489	1489	Ithu korre pullimurugan koppi adichathanalo swalpam ullupu undo  Ennalum njn Kannan pokkum Karanam ente RS 100 kedakkate padathinu	negative	ഇതു കോറ്രേ പുല്ലീമുരുഗന കോപ്പി ആദിചാകനാലോ സ്വാല്പമ ഉല്ലുപു ഉന്ഡോ  എന്നലുംമ നജന കന്നന പോക്കുംമ കരണാമ ആന്റ് ര്സ 100 കേദാക്കേതേ പദതീനും	This Corey Pullimurugana Copy Adichakanal? Swalpama Ullupu undo but also Najana Kannana Let&#39;s go Karanama Ant Rza 100 Kedakate And word
1490	1490	1490	Eee പടം adhar ayirikum enthoke suspense ഒളിഞ്ഞു irikunu	positive	ഈം പട അധര അയിരികുമ എന്ഥോകേ സുസ്പെന്സ് ഒളഞഞ ഇരികുനു	Ahem Army the lip Airikuma what Suspense Olanjana sit down
1491	1491	1491	LALETTAN fan Anu  ennalum  IKKA  NiNGAL  vere LEVEL	positive	ലാലെത്തന ഫന അനു  എന്നലുംമ  ഇക്കാ  നീന്ഗല  വേരാ ലെവല്	Lalethana Fana Anu but also Ika Ningala Vera level
1492	1492	1492	polich ikkkkkkaaaaaaaaaa  kola maaaaaaaaaaas  marana maaaaaaaaaaaaas  triple maaaaaaaaaaaaaaas	positive	പോലീച ഇക്കാ  കോലാ മാസ  മാരാനാ മാസ  ത്രിപ്ല് മാസ	the police Ika Koala month Marana month triple month
1493	1493	1493	Ee cbse mammunji pellare etra muttiyalum goven ment schollela pellaruda adute atella	negative	ഈം കൈസ് മമ്മുംജീ പെല്ലാര് ഏത്ര മുത്തീയലുംമ ഗോവേന മെന്റ് സ്കോളഏലാ പെല്ലാരൂഡ അദൂത അതേല്ലാ	Ahem Kais Mummji Pellar what Muthiya also Govena ment School Pellaruda Aduta Not the same
1494	1494	1494	Dislike chydha appa illaathavanmmaar bloody fools	negative	ഡിസ്ലീകേ ചിധാ അപ്പാ ഇല്ലാതാവന്മ്മാര ബ്ളഊഡി ഫൂള്സ്	Dislike Chidha father Deleted Bloody Fools
